改善 非常 ,0
一定 不求 不知 不错 位置 何必 几乎 喜欢 回去 失手 干净 度假 开始 愿意 抱怨 挂牌 携成 是否 最好 最差 有福 正式 正规 温暖 直到 离开 结合 绝对 要住 ,0
上网 仅仅 可供 回答 失望 好像 快连 摔破 放不下 没蛋 没送 精美 结束 要求 赠送 还有 预订 ,0
一般 不能 可怜 实在 服务 没有 特别 确实 非常 ,0
不能 不错 入住 办好 告诉 手续 退房 ,0
一般 反正 好像 完全 很小 无比 服务 比较 经常 ,0
关掉 只好 很小 很脏 ,0
不通 与否 付费 伟大 供应 免费 反复 害得 开始 打表 挂牌 接听 正确 没有 注意 解释 起来 非常 ,0
位置 偏僻 入住 出来 提供 服务 没有 相当 给定 绝对 走下去 ,0
入住 出来 分别 告知 干净 服务 没有 满意 要放 ,0
停车 决定 吃饭 吓人 干净 得来 打扫 是用 清静 真实 知道 简直 简陋 要选 选择 顶多 ,0
上长 不会 不对 不算 为主 乱放 享受 仔细 偏激 入住 决定 出现 到处 卫生 原来 发现 取代 可见 后悔 否定 喜欢 回头 奇怪 奇痒 好朋友 好评 实在 就是 平整 度假 开发 开始 很毒 手续 抓挠 抱歉 拼命 推荐 无比 更是 曾经 有辱 服务 果断 根本 毫不 没有 消掉 满意 点评 看到 看得出 看看 真的 破碎 离开 简单 管理 紧闭 罢工 萧条 补充 要命 认识 较重 过道 进房 颇为 马上 ,0
不错 就是 得逞 提高 故意 有待 服务 查房 留下 落乡 ,0
不符 卫生 听到 嘶叫 失望 特别 较差 ,0
上网 不了 休闲 免费 入住 出差 包括 可能 回用 实际上 才能 投诉 提供 比较 没有 注意 装修 适合 ,0
上网 不能 买不到 偏僻 免费 刚好 可能 回复 好赚 实在 已经 开始 拉到 拿来 描述 有的 来到 没有 特别 看似 看到 磕碜 简直 繁华 要订 郁闷 ,0
不到 收取 服务 生硬 考虑 装修 过于 退房 ,0
不到 收取 服务 生硬 考虑 装修 过于 退房 ,0
不洁 不知 不错 刺鼻 可有 回来 好在 就是 潮湿 着奇 紧凑 被单 飘溢 ,0
不洁 不知 不错 刺鼻 可有 回来 好在 就是 潮湿 着奇 紧凑 被单 飘溢 ,0
入住 推荐 非常 ,0
上餐 入住 失望 应含 报修 没人 看不出 退房 预定 ,0
一般 也许 入住 再次 刚刚 取消 合同 告诉 回来 就是 影响 愚弄 打开 打扫 推门 服务 根本 没有 直接 离开 起床 进去 连门 ,0
具备 卫生 原来 实施 帮助 延住 打扫 扩大 改建 早就 有的 洗好 看电视 觉得 进入 需要 ,0
竟然 ,0
不好 尤其 服务 比较 ,0
一般 不住 不好 再也 服务 特别 知道 要放 要求 认识 说满 ,0
竟然 ,0
不好 尤其 服务 比较 ,0
不动 就是 淘汰 装修 ,0
不动 就是 淘汰 装修 ,0
卫生 回去 无烟 没在 算了 装修 要求 还好 进去 ,0
享受 出来 实惠 服务 未算 极少 消费 签约 结算 要求 连锁 配置 ,0
严重 倒是 可怜 呵呵 失望 好像 曾经 的确 知道 非常 ,0
不会 入住 后悔 挺大 没有 觉得 ,0
不开 可怜 居然 得到 投诉 指示 没有 答复 要死 需要 ,0
不会 失望 实在 点评 觉得 ,0
不对 指示 非常 麻烦 ,1
不错 实惠 很大 ,1
不加 应该 重视 ,1
一大 不到 不错 介绍 出发 划算 加上 很小 推荐 整洁 是从 比较 消费 确实 自助游 还好 还有 ,1
不好 不足 不错 导致 整洁 方便 设计 ,1
不能 了下 便宜 充电 冲澡 只能 好找 就是 干净 开得 推荐 方便 特意 留意 知道 足够 首先 ,1
不错 周到 就是 居住 开始 接受 推荐 新开 方便 暖和 服务 比较 没有 洗澡 被单 较冷 逛逛 ,1
便利 服务 选择 ,1
不错 休息 坐在 幽静 选择 非常 ,1
不好 不错 免费 升级 希望 应该 服务 真正 碰到 竟然 能够 自然 ,1
一般 不会 不好 不错 交给 从容 光临 免费 升级 反馈 吃饱 处理 宽大 宽阔 就是 已经 干净 很好 提出 提高 明显 更换 最好 最贵 服务 期待 相关 精致 至少 舒服 诚恳 走完 进入 进行 鸟叫 ,1
也经 努力 安排 最大 非常 ,1
不错 位置 告诉 好长 就是 干净 打工 收拾 改进 最大 比较 清洁 表扬 认真 需要 ,1
不错 享受 低于 值得 反复 圆满 服务 比较 消费 督促 确实 纷纷 表扬 解决 遇到 ,1
不通 不错 享受 优惠 停满 入住 即可 提供 服务 根本 没有 疑问请 算了 起来 预订 ,1
免费 入住 刚刚 反馈 喜欢 尊敬 尤其 接送 提供 欣赏 正好 稍远 设有 赶上 ,1
一般 不足 不错 尤其 很好 ,1
一再 居然 提供 提前 没有 点评 申明 补充 要求 预定 ,1
不能 不错 享受 入住 反馈 告知 好吃 尊敬 希望 感到 提交 显得 欠缺 相关 相给 真的 考虑 自助餐 豪华 较晚 还算 退房 选择 酌情 ,1
位置 比较 算高 订到 ,1
上网 不能 不错 也许 位置 免费 入住 可能 就是 接近 服务 比较 满意 特别 略显 稍微 算是 繁华 考虑 非常好 ,1
出于 同样 对待 居然 希望 最好 服务 比较 舒服 难道 非常 ,1
就是 拥堵 进出 非常 ,1
反馈 ,1
位置 可能 备用 直接 还有 非常 非常好 预定 ,1
上选 尤其 已经 方便 没有 知道 ,1
不错 停车 吸引 方便 ,1
位置 停车 宽敞 方便 比较 舒适 ,1
位置 比较 算高 订到 ,1
上网 不能 不错 也许 位置 免费 入住 可能 就是 接近 服务 比较 满意 特别 略显 稍微 算是 繁华 考虑 非常好 ,1
出于 同样 对待 居然 希望 最好 服务 比较 舒服 难道 非常 ,1
就是 拥堵 进出 非常 ,1
位置 可能 备用 直接 还有 非常 非常好 预定 ,1
上选 尤其 已经 方便 没有 知道 ,1
发现 回来 领走 ,1
不错 停车 吸引 方便 ,1
位置 停车 宽敞 方便 比较 舒适 ,1
一般 入住 好像 干净 必答 整洁 有求 服务 点评 补充 ,1
不错 ,1
不错 服务 没有 选择 ,1
入住 开始 忘记 点评 补上 ,1
入住 已经 忘记 点评 立即 补上 重视 ,1
工作 最好 选择 ,1
仍然 工作 干净 整洁 最好 服务 稍旧 表扬 装修 选择 ,1
最好 最高 没有 ,1
亲自 副理 太慢 感动 服务 道歉 非常 ,1
值得 到位 推荐 服务 管理 非常 非常好 ,1
不错 停车 别扭 就是 服务 还有 ,1
不错 丰富 入住 好找 查看 注重 点评 真的 舒服 超赞 ,1
接待 服务 ,1
不收 不送 便宜 只能 打车 方便 最好 比较 清静 远眺 送餐 ,1
方便 非常好 ,1
满意 真是 选择 ,1
一般 像是 出行 可能 居然 当然 提供 方便 比较 要求 设备 退房 ,1
一般 上网 不足 不远 不错 位置 便宜 好在 属于 很快 成熟 服务 没有 特别 ,1
不到 不許 中國 丰富 仍然 加付 原先 吸煙 吸煙者 处理 学习 就是 希望 干净 忍受 成為 房間 抽煙 提升 放进 无烟 服從 沒有 没有 看到 自覺 規則 評論 謝謝 還是 電梯 需要 非常好 ,1
已经 快递 找到 服务 负责 非常 ,1
不错 刻意 就是 没有 要算 选择 预订 ,1
不能 周到 惊扰 改进 服务 未眠 询问 ,1
一般 不错 出去 就是 算是 ,1
不错 介绍 停车 入住 决定 已经 快捷 提着 操作 方便 更好 服务 登记 还有 退房 ,1
不错 便宜 方便 相配 装修 ,1
不久 不错 允许 光临 全新 再次 反馈 实在 建造 提出 施工 明确 服务 正常 表示 诚挚 迎接 选择 非常 首先 ,1
不错 偏高 出入 分离 吃饭 就是 属于 应该 打招呼 还有 适合 ,1
不错 丰富 位置 ,1
不太好 不好 就是 打开 方便 日本人 服务 比较 真的 ,1
一般 接受 比较 觉得 难以 ,1
下楼 不到 不知 不错 作用 停车 入住 再次 加装 原先 原来 可否 复杂 好像 实用 宽敞 应该 接受 改进 方便 比如 没有 熄灯 看来 继续 考虑 舒服 觉得 访客 豪华 负责 ,1
一定 不够 不比 不错 亮起 人像 但愿 停车 停靠 入住 入睡 兼顾 出名 叮当声 吃饭 回应 安排 实用 尝尝 就餐 希望 应该 度假 忠实 打烊 拿到 改进 方便 是否 暗暗 服务 极好 欣赏 没有 没能 浸染 消费 留下 相对 相当于 遇到 靠近 驶过 高速 ,1
不错 入住 处在 常常 挑选 服务 热闹 特别 蛮高 需要 ,1
一般 接受 比较 觉得 难以 ,1
下楼 不到 不知 不错 作用 停车 入住 再次 加装 原先 原来 可否 复杂 好像 实用 宽敞 应该 接受 改进 方便 比如 没有 熄灯 看来 继续 考虑 舒服 觉得 访客 豪华 负责 ,1
一定 不够 不比 不错 亮起 人像 但愿 停车 停靠 入住 入睡 兼顾 出名 叮当声 吃饭 回应 安排 实用 尝尝 就餐 希望 应该 度假 忠实 打烊 拿到 改进 方便 是否 暗暗 服务 极好 欣赏 没有 没能 浸染 消费 留下 相对 相当于 遇到 靠近 驶过 高速 ,1
不错 入住 处在 常常 挑选 服务 热闹 特别 蛮高 需要 ,1
一般 不错 干净 ,1
不好 不错 位置 免费 发霉 导致 提供 极滑 沾水 结露 非常 非常好 ,1
一般 不严 不了 可能 可言 呼呼 如同 尽量 引发 想必 明显 是非 没有 确实 进来 ,1
不能 不该 可能 吵闹 困扰 存在 就是 应该 开始 得很 敲门 方便 有的 服务 ,1
不快 不错 入住 到达 发生 弥补 愉快 服务 ,1
不错 入住 好像 就是 干净 最好 比较 直面 综合 装修 还有 ,1
不爽 不错 便利 入住 出入 发现 可怜 实在 对比 干净 很大 很小 整洁 旅行 比较 简单 紧邻 落差 设备 起来 适合 骄傲 ,1
一定 取境 完璧 归照 收到 服务 来电 离开 退房 非常好 ,1
不能 尽可能 愿意 最高 服务 没有 非常 ,1
合适 服务 ,1
不错 比较 烧烤 确实 自助 ,1
享受 完全 服务 超值 非常好 ,1
不用 免费 干净 延住 舒服 超值 ,1
似乎 入住 应该 很远 打招呼 指示 明显 服务 比起 知道 见到 问好 ,1
不错 入住 尤其 就是 干净 服务 果然 点评 特别 直面 自助 豪华 配套 预定 ,1
不足 入住 分别 告知 实惠 并未 开车 感到 感动 手续 找到 提供 服务 比较 要到 ,1
提前 收取 服务 满足 特别 要求 送到 ,1
一般 上心 不少 不愧 不漏 不错 严实 丰富 似乎 入住 冰过 准备 出去 出来 到达 反馈 发现 只能 听到 启明 告知 告诉 呵呵 哗哗 喜欢 喝粥 回来 处理 好了 导致 尊敬 尽力 居然 希望 应该 度假 忘记 惊讶 想法 拿来 提交 提供 提出 提前 放心 最高 有误 服务 欢迎 比较 没房 泡澡 洗澡 满足 点评 留言 看到 破坏 确认 补充 试试看 豪华 郁闷 随便 需求 预定 ,1
决定 合口 周到 服务 满意 绝对 见到 ,1
不能 尽可能 愿意 最高 服务 没有 非常 ,1
合适 服务 ,1
不错 比较 烧烤 确实 自助 ,1
下回 方便 服务 ,1
不用 免费 干净 延住 舒服 超值 ,1
似乎 入住 应该 很远 打招呼 指示 明显 服务 比起 知道 见到 问好 ,1
不错 入住 尤其 就是 干净 服务 果然 点评 特别 直面 自助 豪华 配套 预定 ,1
不足 入住 分别 告知 实惠 并未 开车 感到 感动 手续 找到 提供 服务 比较 要到 ,1
提前 收取 服务 满足 特别 要求 送到 ,1
一般 上心 不少 不愧 不漏 不错 严实 丰富 似乎 入住 冰过 准备 出去 出来 到达 反馈 发现 只能 听到 启明 告知 告诉 呵呵 哗哗 喜欢 喝粥 回来 处理 好了 导致 尊敬 尽力 居然 希望 应该 度假 忘记 惊讶 想法 拿来 提交 提供 提出 提前 放心 最高 有误 服务 欢迎 比较 没房 泡澡 洗澡 满足 点评 留言 看到 破坏 确认 补充 试试看 豪华 郁闷 随便 需求 预定 ,1
决定 合口 周到 服务 满意 绝对 见到 ,1
不错 偏高 干净 活动 ,1
下回 不错 干净 服务 ,1
不错 入住 服务 ,1
一般 上网 不错 位置 免费 刚好 加班 就是 干净 想想 没有 点评 能够 补充 还算 ,1
入住 大连 选择 ,1
不少 入住 很脏 推荐 考察 豪华 非常 ,1
一般 不错 倒是 却是 可惜 很小 旋转 老是 装修 ,1
一般 不错 偏贵 凑合 刚好 告诉 开始 没有 询问 预订 ,1
不错 实在 打车 接待 方便 ,1
下回 不错 干净 服务 ,1
不错 入住 服务 ,1
不少 入住 很脏 推荐 考察 豪华 非常 ,1
一般 不错 倒是 却是 可惜 很小 旋转 老是 装修 ,1
一般 不错 偏贵 凑合 刚好 告诉 开始 没有 询问 预订 ,1
不错 实在 打车 接待 方便 ,1
划算 没有 ,1
享受 开始 来不及 没有 装修 ,1
不太好 不错 尤其 服务 点名 表扬 ,1
一律 一般 不大 不断 不能 做出 免得 免费 入住 再次 反映 反馈 夸张 就是 差得远 希望 干脆 开通 影响 批示 提出 提升 整改 更多 最多 来讲 注意 看着 知道 确实 碍眼 稍微 竟然 算了 超爽 选择 遇见 ,1
不错 体现 呵呵 当然 摆放 服务 特别 ,1
上网 下班 不错 住下 免费 服务 满意 装修 负责 送机 ,1
丰富 介绍 干净 服务 豪华 非常 ,1
一定 下榻 不错 反馈 已经 希望 接送 提出 支持 改水 改过来 整改 是否 服务 满意 知道 竭诚 选择 ,1
不错 可惜 可能 实惠 方便 比较 起来 ,1
上网 不能 位于 就是 很小 很快 方便 适合 透明 配有 ,1
作用 入睡 反映 常常 没有 起到 ,1
不错 例如 宽敞 改进 相对 ,1
不错 出来 奇怪 方便 点评 补充 预定 ,1
便利 偏低 入住 参加 合适 就是 承认 搞错 服务 算是 预定 ,1
刚好 合适 很大 按摩 有的 正常 比较 软硬 ,1
不想 不错 喜欢 ,1
不断 位置 出差 可见 完善 方便 装修 认为 重视 非常好 ,1
上网 不必 使用 免费 入住 发送 堵车 很快 愉快 担心 排除 方便 极好 还有 ,1
一定 一直 下沉 不大 侃价 充溢 出租 参展 可租 可能 呵呵 喜欢 实惠 应该 打到 打车 提醒 改善 整整 无关 更好 比较 点评 烹炸 煎烤 稍微 自然 舒服 补充 附加 ,1
不错 享受 入住 去处 取去 就是 惬意 方便 最深 比较 浪漫 睡着 算是 自助餐 认为 躺上去 辉映 ,1
上升 不肯 不错 入住 处理 失望 实在 就要 居然 得来 服务 比较 没有 选在 ,1
使用 友善 已经 很好 方便 舒适 装设 起来 选择 配套 非常好 ,1
便宜 就是 方便 服务 舒服 ,1
上网 位置 出门 喜欢 就是 居然 方便 比较 考虑 连接 难道 需要 非常 非常好 ,1
不错 呵呵 希望 方便 非常 ,1
位置 就是 干净 整洁 缺少 遗憾 ,1
一般 位置 合适 比较 自助游 ,1
作为 免费 升级 怡好 相比 进步 鼓励 ,1
不错 管理 ,1
不错 保养 服务 送餐 非常好 ,1
不能 不配 保留 入住 取消 只能 回事 回答 居然 干脆 授权 接到 方便 有没有 注意 简直 负责 随意 预定 ,1
一般 位置 保持 入住 发车 取用 吃饭 听到 就是 建于 找到 提前 新换 日出 早起 最爱 服务 满意 直达 看到 确实 肯定 自觉 适量 ,1
了住 满意 略显 选择 ,1
不错 大连 搞错 ,1
冷淡 准备 原来 听说 就是 广泛 效果差 点评 知道 确实 选择 ,1
了解 享受到 从事 优秀 位于 充满 入住 关注 典雅 周到 喧闹 希望 带给 惬意 感到 感谢 推开 明亮 更多 服务 来到 来自 没有 漂亮 特别 看过 真切 真是 真正 美好 舒适 觉得 解决困难 认识 试试看 迎面 送上 需求 面对 高高 ,1
一般 不错 入住 实在 导致 就是 干净 放水 服务 没有 清理 漂浮 看到 自助餐 达到 还有 选择 ,1
打开 看见 装修 记得 豪华 重新 非常好 ,1
不出 不用 不错 丰富 作为 入住 受欢迎 喜爱 就是 推荐 旅游 欣赏 深受 添加 点心 特别 相对 确实 简单 解决 较佳 选择 ,1
不错 交涉 优美 值得 停止 入住 再次 差一点 干净 施工 点评 确实 稍微 维护 补充 表示歉意 适中 道歉 非常好 ,1
不大 不太好 周到 喜欢 就是 度假 很好 很美 服务 比较 看到 设置 遇到 邻居 ,1
不错 入住 出门 周到 大概 打车 挺大 服务 独立 ,1
一般 位置 保持 入住 发车 取用 吃饭 听到 就是 建于 找到 提前 新换 日出 早起 最爱 服务 满意 直达 看到 确实 肯定 自觉 适量 ,1
了住 满意 略显 选择 ,1
不错 最好 非常好 ,1
冷淡 准备 原来 听说 就是 广泛 效果差 点评 知道 确实 选择 ,1
了解 享受到 从事 优秀 位于 充满 入住 关注 典雅 周到 喧闹 希望 带给 惬意 感到 感谢 推开 明亮 更多 服务 来到 来自 没有 漂亮 特别 看过 真切 真是 真正 美好 舒适 觉得 解决困难 认识 试试看 迎面 送上 需求 面对 高高 ,1
一般 不错 入住 实在 导致 就是 干净 放水 服务 没有 清理 漂浮 看到 自助餐 达到 还有 选择 ,1
打开 看见 装修 记得 豪华 重新 非常好 ,1
不出 不用 不错 丰富 作为 入住 受欢迎 喜爱 就是 推荐 旅游 欣赏 深受 添加 点心 特别 相对 确实 简单 解决 较佳 选择 ,1
不错 交涉 优美 值得 停止 入住 再次 差一点 干净 施工 点评 确实 稍微 维护 补充 表示歉意 适中 道歉 非常好 ,1
不大 不太好 周到 喜欢 就是 度假 很好 很美 服务 比较 看到 设置 遇到 邻居 ,1
不错 入住 出门 周到 大概 打车 挺大 服务 独立 ,1
不够 丰富 享受 作为 充分 很好 很新 ,1
一般 似乎 比较 满意 设计 非常 ,1
下车 不同 不想 不错 估计 便宜 到达 受到 吃饭 吝啬 告知 喝茶 妖艳 希望 帮送 开放 打扮 服务 比较 没人 游泳 猜错 看到 舒服 装修 说话 进口 郁闷 难道 ,1
不够 丰富 享受 作为 充分 很好 很新 ,1
一般 似乎 比较 满意 设计 非常 ,1
不错 居然 打扫 ,1
方便 服务 舒适 ,1
方便 服务 舒适 ,1
不住 再也 很大 忍忍 或许 服务 ,1
不错 应该 满意 ,1
下雨 不错 停车 刚好 就是 惬意 拉开 方便 最深 碰到 ,1
吸引 希望 更换 长途 ,1
不了 位置 堵车 就是 方便 ,1
下回 方便 服务 ,1
不错 丰盛 兜去 兜来 到处 喜欢 坐车 接客 方便 最好 耽误时间 非常 ,1
不远 免费送 出钱 吝啬 好像 就是 比较 没要 洗澡 热闹 装修 起来 ,1
不足 位置 反应 好像 就是 比较 看到 真实 迟钝 非常好 ,1
位置 就是 自助 ,1
一般 不知 优越 保养 入住 投入 日常 明显 曾经 有静 服务 比较 看得出 破败 经营 维护 舍得 辉煌 选择 ,1
上订 入住 写订 可惜 处理 好吃 实惠 实际上 希望 应该 开心 忘记 改善 方便 旅行 最好 朴实 没有 游览 登记 着想 答复 给予 给到 舒服 要求 选择 需要 ,1
上网 不符 不能 不错 同去 吵闹 抱怨 相当 隔离 非常 ,1
一大 不到 应该 最好 毕竟 算是 重取 ,1
不错 值得 充电 听到 回答 就是 很美 或许 推荐 改进 有待 服务 没有 看到 真是 突出 ,1
优雅 位置 入住 呵呵 干净 手续 接待 比较 没有 清新 离住 非常好 ,1
入住 大连 选择 ,1
一再 不夠 不等 中國 也許 他們 以後 似乎 停電 入住 再說 及時 取暖 問題 因為 培訓 完全 寒磣 專業 尤其 就是 平心而論 建議 心態 惡劣 感動 感覺 感覺到 應該 我們 房間 拉開 挑剔 提出來 時候 最好 有點 服務 服務員 標準 比擬 沒有 沙發 理解 環境 當然 發電 發電機 碰到 確實 禮儀 窗簾 經過 緊張 聽說 舒服 衛生 衡量 裝修 親切 設施 調試 豪華 跑到 過於 還是 重新 關係 電力 面積 顧客 風景 ,1
可惜 居然 忘记 服务 满分 继续 ,1
不错 可惜 好吃 好好 开车 最好 没有 舒服 装修 觉得 ,1
不错 方便 服务 ,1
不错 很大 算是 ,1
不爽 不错 出行 安排 实在 就是 并列 感受到 方便 旅游 比较 没有 组成 设备 较大 还有 ,1
不错 免费 刚刚 只能 好像 好吃 宣传 属于 很贵 想到 按摩 服务 欢迎 比较 点评 相比 看到 真是 肯定 补充 觉得 记不 豪华 赠送 达到 选择 ,1
不错 位置 出行 刚好 就是 工作 应该 方便 来讲 比较 相当 罢工 考虑 赶上 选择 ,1
不爽 倒是 分到 只能 同去 坏掉 完全 挺快 满意 积极 至少 落水 ,1
一般 不符 估计 同样 实在 很大 感动 放在 服务 真是 竟然 豪华 退房 ,1
划算 没有 ,1
不错 很大 挺贵 调整 ,1
其实 喜欢 就是 悦华 服务 装修 ,1
其实 就是 服务 装修 讲究 ,1
可能 干净 摆放 清爽 舒适 ,1
不错 入住 称赞 超值 ,1
不错 入住 很快 方便 退房 ,1
不错 划算 坐到 大约 整洁 更是 服务 舒服 ,1
不足 不错 导致 带够 最高 舒心 输错 ,1
不错 很大 挺贵 调整 ,1
其实 喜欢 就是 悦华 服务 装修 ,1
不够 不错 干净 很远 整洁 方便 服务 没有 要定 超市 ,1
不错 例如 宽敞 改进 相对 ,1
其实 就是 服务 装修 讲究 ,1
可能 干净 摆放 清爽 舒适 ,1
不错 入住 称赞 超值 ,1
不错 入住 很快 方便 退房 ,1
不错 划算 坐到 大约 整洁 更是 服务 舒服 ,1
不足 不错 导致 带够 最高 舒心 输错 ,1
不错 合理 干净 ,1
上锁 不够 不能 不错 存在 安全 已经 开启 没有 确实 舒服 较大 较慢 进入 非常 ,1
不错 干净 很雅 肯定 还定 ,1
得多 看来 ,1
便宜 就是 方便 服务 舒服 ,1
不错 合理 干净 ,1
上锁 不够 不能 不错 存在 安全 已经 开启 没有 确实 舒服 较大 较慢 进入 非常 ,1
不错 干净 很雅 肯定 还定 ,1
得多 看来 ,1
作为 出差 方便 服务 选择 预定 ,1
一早 例给 做出 光临 再次 到位 反馈 回复 培训 处理 大概 好像 尊敬 工作 度假 得很 惊讶 感动 打扫 提供 支持 是以 服务 没有 温暖 生动 立即 被评 负责 远不如 送来 遇到 非常 顺利 ,1
服务 ,1
一般 值得 合理 推荐 服务 比较 相当 ,1
一般 不会 不幸 不理 不错 倒是 偶尔 免提 免费 入住 其实 准确 几乎 出差 发现 只顾 可能 听到 回来 好了 安全 完全 容忍 就是 希望 带走 干净 开始 当然 得到 怕怕 意外 感冒 感动 慰问 打不 拨入 挺好 挺好吃 接待 掰断 提个醒 摔倒 放在 放置 整整 方便 晕倒 最深 服务 查房 比如 没有 清洗 点评 烦躁 照顾 特别 直接 看起来 真实 真的 知道 竟然 紧张 考虑 能否 能够 衡量 认为 超过 还有 进去 进来 退房 郁闷 长脸 频繁 骄傲 ,1
一早 不让 不错 临走 停车 出门 剔除 合作 回不去 回去 回来 实在 对比 帮忙 很小 感谢 扔掉 拿走 推荐 更是 有损 服务 比较 没收 没有 点评 特意 竟然 聊上 高速 ,1
不错 大连 搞错 ,1
一定 一早 一般 丢在 入住 出差 发现 回来 感动 感谢 掏钱 查询 没有 直到 确实 难得 ,1
下调 不错 入住 居然 知道 紧促 舒服 ,1
不错 料理 牵强 的确 称作 还有 ,1
丰盛 优雅 入住 可惜 服务 相当 绝对 选择 ,1
不错 丰富 为主 ,1
一般 优雅 入住 出差 卫生 发现 可住 整洁 是否 检查 残留 没有 确实 需要 ,1
停车 奇怪 应该 ,1
一般 不错 便宜 到达 号称 已经 干净 很大 据说 提前 没有 考虑 要求 计较 订好 ,1
不错 为主 免费 可能 好像 应该 很值 很快 推荐 改造 点评 知道 结束 自助 补充 试试 还有 适合 ,1
不错 丰富 为主 ,1
不错 最好 非常好 ,1
一般 优雅 入住 出差 卫生 发现 可住 整洁 是否 检查 残留 没有 确实 需要 ,1
停车 奇怪 应该 ,1
一般 不错 便宜 到达 号称 已经 干净 很大 据说 提前 没有 考虑 要求 计较 订好 ,1
不错 为主 免费 可能 好像 应该 很值 很快 推荐 改造 点评 知道 结束 自助 补充 试试 还有 适合 ,1
不好 不错 亟待 亲切 值得 停水 入住 完美 就是 尴尬 很快 惬意 推荐 提高 方便 服务 比较 比邻 直接 真的 答复 给予 维修 询问 走上 赶上 起来 还有 ,1
一般 位于 位置 入住 再次 得出 服务 进门 ,1
周到 尤其 服务 ,1
不多 不小 不错 位置 服务 考虑 还好 ,1
下车 不远 不错 位置 卫生 告知 就是 帮忙 提前 服务 正常 比较 需要 非常好 预留 ,1
下班 不好 不能 早睡 ,1
下车 不同 不想 不错 估计 便宜 到达 受到 吃饭 吝啬 告知 喝茶 妖艳 希望 帮送 开放 打扮 服务 比较 没人 游泳 猜错 看到 舒服 装修 说话 进口 郁闷 难道 ,1
一直 不小 不足 不错 入住 出来 就是 已经 并不大 开车 很快 得到 得很 惊喜 换到 服务 没有 烧烤 留好 疑惑 看不到 看到 稍差 穿过 精致 著名 记住 赠送 还有 预订 ,1
不错 加上 危险 只能 告知 围挡 感到 掉下 更好 服务 玩耍 舒服 行走 要求 预定 ,1
方便 服务 非常好 ,1
吃饭 很偏 方便 服务 非常好 ,1
免费 拍摄 据说 摆在 比较 编写 赠送 还有 ,1
先进 堪称 少有 接受 特别 豪华 ,1
从来 周到 服务 没有 特别 ,1
不好 不错 入住 出来 呵呵 容易 很好 打车 满意 紧靠 走出 还有 ,1
不错 就是 真的 ,1
休闲 出去 可惜 幽静 度假 开车 方便 比较 自驾 适合 ,1
方便 服务 比较 ,1
一定 一直 不错 尤其 就是 很大 清澈 满意 盛开 确实 舒服 走上 还有 非常 ,1
不错 加上 危险 只能 告知 围挡 感到 掉下 更好 服务 玩耍 舒服 行走 要求 预定 ,1
方便 服务 非常好 ,1
吃饭 很偏 方便 服务 非常好 ,1
免费 拍摄 据说 摆在 比较 编写 赠送 还有 ,1
先进 堪称 少有 接受 特别 豪华 ,1
从来 周到 服务 没有 特别 ,1
不好 不错 入住 出来 呵呵 容易 很好 打车 满意 紧靠 走出 还有 ,1
不错 就是 真的 ,1
休闲 出去 可惜 幽静 度假 开车 方便 比较 自驾 适合 ,1
入住 准备 务必 发现 名叫 妥善处理 已经 手续 没有 注意 注明 特意 通知 预先 ,1
一定 一直 不错 尤其 就是 很大 清澈 满意 盛开 确实 舒服 走上 还有 非常 ,1
不错 入住 考虑 ,1
不用 入住 打到 方便 是否 看到 退房 随时 需要 预定 ,1
