改善 非常 ,0
一般 不得不 不用 不能 不错 也许 倒是 就是 归航 打渔 打车 日出 服务 点评 真诚 缺乏 自助 补充 ,1
不写 不错 入住 服务 没有 ,1
不错 干净 很厚 服务 松软 满意 非常 ,1
不错 入住 考虑 ,1
不用 入住 打到 方便 是否 看到 退房 随时 需要 预定 ,1
一般 不得不 不用 不能 不错 也许 倒是 就是 归航 打渔 打车 日出 服务 点评 真诚 缺乏 自助 补充 ,1
不写 不错 入住 服务 没有 ,1
出差 打车 方便 服务 比较 超市 ,1
不错 干净 很厚 服务 松软 满意 非常 ,1
服务 细致 ,1
位置 入住 到位 呵呵 存放 就是 服务 离开 还好 ,1
不能 不错 只能 吃饭 已经 干净 接水 撑开 整洁 方便 满意 看到 蛮好 调节 豪华 还有 进去 ,1
不错 方便 服务 比较 ,1
一般 不了 不错 看到 豪华 非常 ,1
一定 入住 工作 很快 感谢 真的 紧张 赶上 通知 遗忘 ,1
入住 已经 方便 超市 ,1
不快 不错 发现 好像 开关 抹杀 无知 没有 洗澡 爆慢 真不 真爽 竟然 跳闸 ,1
凉快 没有 ,1
服务 比较 ,1
便利 到位 培训 就是 居然 开封 想到 服务 果然 没有 繁华 ,1
很脏 服务 非常好 ,1
凉快 没有 ,1
便利 到位 培训 就是 居然 开封 想到 服务 果然 没有 繁华 ,1
很脏 服务 非常好 ,1
一般 不到 不错 发现 就是 巡逻 推荐 提醒 方便 旅游 比较 没关 略显 非常 ,1
实在 希望 改进 ,1
不了 不错 吃饭 告诉 就是 居然 干净 开车 方便 比较 没有 简直 自驾 说起 还有 ,1
一般 不错 ,1
不错 前住 喜歡 服務 沒泡 洗澡 溫泉 空調 超前 遺憾 ,1
上网 反馈 大连 完成 尽快 工作 已经 希望 干净 应该 很大 很快 支持 改进 改造 整修 服务 装修 较大 选择 透进 ,1
一直 不错 体现 值得 做成 免费 出来 取消 培训 导致 就是 度假 成功 授权 推荐 撤销 是从 服务 毕竟 没有 消费 相比 稍嫌 表现 进门 远眺 马上 ,1
作为 干净 整洁 ,1
一般 不错 大佛 开穿 看见 远眺 ,1
入住 即可 召开 吃到 打车 方便 有名 靠近 ,1
不够 不错 友好 对得起 就是 很大 敲诈 最好 ,1
也许 剥落 同意 呵呵 大佛 很大 服务 比较 看到 舒服 还有 ,1
不太好 不错 入住 出水 均匀 宽敞 提前 整齐 方便 服务 比较 洗澡 笼头 耽误时间 舒服 靠近 ,1
不错 就是 首选 ,1
不错 变成 就是 常驻 ,1
干净 比较 良好 ,1
不对 指示 非常 麻烦 ,1
一时 不会 不到 不用 保留 入住 喜好 回顾 增加 安排 尊重 就是 居然 应不应该 弯腰 当然 投诉 收拾 标配 欣慰 比较 没有 点评 的次 相应 知道 管理 终于 至少 豪华 预先 预定 首先 ,1
不好 不错 停车 免费 应该 极贵 满意 特别 降低 ,1
不错 入住 方便 正好 考虑 ,1
位置 入住 舒服 ,1
不错 喜欢 指定 ,1
一般 不错 喜欢 尤其 服务 见不着 ,1
不错 入住 出差 吃饭 方便 ,1
不大 不错 免费 入住 典雅 发现 听说 干净 推荐 日本人 有点像 服务 没有 看见 精致 糟糕 舒服 豪华 选择 ,1
上班 也许 位置 入住 吵得 干净 摆设 服务 没有 漂亮 睡着 确认 舒服 装修 评述 豪华 还好 进展 非常好 ,1
不错 微笑 服务 比较 碰到 见到 问好 非常 ,1
不错 位置 取消 告诉 培训 找到 有待 知道 还过得去 预订 ,1
一致 不错 优化 使用 升级 反馈 受到 大连 好评 帮助 推广 活动 满意 舒服 良好 认可 进一步 适合 需要 非常 ,1
不错 到位 干净 很快 授权 收钱 有的 服务 比较 没有 看着 ,1
不算 不远 品尝 喜欢 方便 睡觉 购买 ,1
不好 不足 不错 属于 希望 干活 很大 排档 改进 服务 ,1
一般 方便 服务 比较 适中 ,1
一般 不太好 卫生 服务 ,1
不敢 看到 ,1
不好 不能 不错 太大 希望 想要 抱有 服务 没有 清理 真的 确实 装修 要求 过于 进行 ,1
出门 可买 大约 就是 比较 装修 ,1
不错 开阔 有重 相当 装修 ,1
位置 完善 就是 服务 比较 较好 ,1
优惠 免费 入住 全新 升级 反馈 喜欢 回馈 大连 希望 意外 推出 支持 活动 满意 豪华 ,1
推荐 装修 豪华 ,1
不了 不好 不错 位置 值得 具有 冷淡 好在 就是 干净 并不大 快活 推荐 比较 直白 繁华 舒服 装修 觉得 ,1
不错 作为 只能 完全 实在 居然 应该 比较 没有 满意 看到 竟然 算是 自驾 贴心 醒目 ,1
入住 反馈 实惠 希望 ,1
入住 再次 反馈 实惠 欢迎 ,1
一般 不到 不好 不错 了解 其实 反馈 存在 对此 就是 打扰 摆设 支持 最好 服务 格外 没有 热醒 照顾 看到 经常 觉得 豪华 预定 ,1
一般 反馈 应该 很好 现已 知道 装修 重新 ,1
不能 只能 就是 干净 方便 服务 直接 需要 ,1
不错 值得 方便 服务 非常 ,1
不敢 不知 不错 使用 反馈 可爱 喜爱 安装 尤其 展开 已经 广大 庞大 开始 投入 方便 普遍 更好 服务 标示 正式 比较 没有 深受 满意 烘干 熟练 生意 电控 相信 相当 结束 装修 非常 ,1
一直 不大 不错 专卖 出差 升级 干净 没有 满意 知道 豪华 预定 ,1
一般 上网 对得起 比较 超值 麻烦 ,1
不错 合理 应该 排到 比起 配置 ,1
不快 不错 予以 体现 例如 做好 免费 入住 共同 再次 升级 反馈 可能 告诉 宽敞 干净 弄得 拨打 推荐 提前准备 提议 整洁 有没有 服务 查看 比较 没有 清凉 满意 点评 猜想 直接 终究 要求 认可 询问 谢绝 豪华 貌似 还有 选择 预定 预订 ,1
不错 丰富 享受 休息 光临 入住 再次 反馈 大块头 好好 更多 服务 期待 来得及 比较 没有 点评 看到 紧张 给予 重视 ,1
光临 再次 反馈 工作 期待 生活 留言 认可 选择 ,1
不错 光临 再次 反馈 宽敞 尽量 工作 愉快 提出 提高 期待 比较 生活 研究 简化 繁锁 认可 ,1
不错 予以 光临 入住 再次 决定 即往 反馈 干净 微笑 服务 期待 认可 选择 ,1
不错 予以 使用 停车 光临 入住 再次 反馈 就是 工作 愉快 有没有 有限 服务 期待 比较 生活 知道 能供 自助餐 认可 选择 非常 顺利 ,1
不错 值得 光临 再次 反馈 应该 推荐 服务 期待 比较 算是 认可 ,1
不错 丰富 睡觉 自助餐 较大 ,1
不错 予以 光临 入住 再次 升级 反馈 售完 服务 期待 热切 经常 认可 豪华 ,1
不错 优越 入住 出家 反馈 工作 愿意 成为 服务 欢迎 经常 认可 还有 非常 顺利 ,1
光临 入住 再次 出来 反馈 工作 希望 开心 感受到 提出 摔了一跤 改进 期待 洗澡 点评 看到 研究 选择 顺利 ,1
位置 可能 比较 ,1
不能 停车 入住 方便 正门 比较 直接 要出 进入 首选 ,1
不错 据说 试试 ,1
不足 不错 显然 横向 比较 ,1
不错 合适 开始 比较 特别 调到 ,1
不好 保留 愿意 拿到 提供 比较 没有 确实 让利 起来 ,1
不错 呵呵 没住 认为 ,1
不可以 不足 不错 就是 延期 必须 找到 旅游 正是 比较 继续 退房 ,1
不好 入住 协调 单独 极其 比较 没有 考虑 ,1
位置 可能 比较 ,1
不能 停车 入住 方便 正门 比较 直接 要出 进入 首选 ,1
不错 据说 试试 ,1
不足 不错 显然 横向 比较 ,1
不错 合适 开始 比较 特别 调到 ,1
不好 保留 愿意 拿到 提供 比较 没有 确实 让利 起来 ,1
不错 呵呵 没住 认为 ,1
不好 入住 协调 单独 极其 比较 没有 考虑 ,1
不错 入住 只好 可能 愉快 推荐 搞错 新来 没有 淋坏 确实 确认 ,1
不错 只能 奢侈 打车 拖延 旅行 服务 来讲 没有 确认 自助 通知 ,1
不错 出行 方便 无意 觉得 预定 ,1
不满 呵呵 实惠 比较 没有 特别 ,1
不能 不错 介绍 划算 只能 失望 安排 就是 尽量 有的 直接 确认 要求 超过 非常 预定 预订 ,1
整洁 明亮 服务 比较 舒适 良好 ,1
不错 干净 最好 真的 选择 需要 ,1
一般 位置 挺远 舒服 选择 ,1
尝试 希望 ,1
位置 尝试 ,1
不变 不错 入住 卫生 周到 尤其 干净 提出 携带 有大 服务 看到 真是 肯定 超值 选择 ,1
卫生 显得 还好 ,1
不错 可惜 干净 方便 最大 比较 注意 清醒 看看 觉得 非常 ,1
尝试 希望 ,1
位置 尝试 ,1
不变 不错 入住 卫生 周到 尤其 干净 提出 携带 有大 服务 看到 真是 肯定 超值 选择 ,1
不错 可惜 干净 方便 最大 比较 注意 清醒 看看 觉得 非常 ,1
一般 便宜 就是 起来 ,1
也许 升级 实在 很好 得知 无愧于 更换 曾经 服务 满意 看到 装修 重新 ,1
不够 应该 很大 最好 来讲 没有 遗憾 ,1
一般 ,1
不到 不错 位于 单独 听说 应该 成为 方便 服务 来讲 比较 没有 非常 ,1
不少 繁华 较大 适中 ,1
不会 做饭 入住 吐出来 奇怪 安排 实在 快要 把握 换到 没有 真是 肯定 要求 说明 还有 重视 非常 ,1
一定 免费 升级 受到 听说 告诉 好看 安排 接待 更好 特别 看到 觉得 还有 进入 重要 非常 预订 ,1
不错 接收 方便 稍微 超市 选择 ,1
不错 回来 据说 最好 服务 比较 维护 设备 ,1
一般 便宜 就是 起来 ,1
也许 升级 实在 很好 得知 无愧于 更换 曾经 服务 满意 看到 装修 重新 ,1
不够 应该 很大 最好 来讲 没有 遗憾 ,1
一般 ,1
不到 不错 位于 单独 听说 应该 成为 方便 服务 来讲 比较 没有 非常 ,1
不会 做饭 入住 吐出来 奇怪 安排 实在 快要 把握 换到 没有 真是 肯定 要求 说明 还有 重视 非常 ,1
上网 不能 打车 方便 看到 ,1
一定 免费 升级 受到 听说 告诉 好看 安排 接待 更好 特别 看到 觉得 还有 进入 重要 非常 预订 ,1
不错 接收 方便 稍微 超市 选择 ,1
不错 回来 据说 最好 服务 比较 维护 设备 ,1
发现 没有 还好 进来 造成 ,1
一般 就是 服务 比较 ,1
不错 位置 入住 ,1
一般 没有 离开 ,1
出差 方便 比较 熟悉 相对 经常 还有 ,1
估计 便宜 匹配 压抑 呵呵 就是 提供 比较 没有 简陋 缺少 舒服 豪华 ,1
不错 很棒 服务 比较 看上去 算是 ,1
不错 实惠 很大 ,1
不好 不错 决定 卫生 友好 在意 大连 尤其 就是 很快 得到 打扫 日本人 服务 比较 满意 点评 直达 看到 补充 解决 讨厌 选择 重要 ,1
不到 不好 勉强 处在 应该 ,1
不到 便宜 入住 只能 感想 最多 ,1
不错 位置 带上 比较 泡澡 ,1
很快 搞定 服务 比较 ,1
不好 便利 就是 应该 解决 达车 需要 ,1
实在 尤其 改进 有待 服务 装修 ,1
影响 得很 比较 清楚 睡觉 说话 进出 ,1
不做 健身 出差 喜欢 方便 比较 没有 满意 特别 ,1
,1
不错 优雅 接待 服务 装修 ,1
一般 下楼 不大 不足 冲洗 只敢 回来 垂下来 大便 好像 干净 应该 很大 得到 才能 打不开 按摩 方便 最深 满意 烧来 碰到 竟然 答复 细致 舒服 赶紧 进入 非常 非得 ,1
应该 ,1
不错 吃饭 回应 方便 服务 要求 ,1
觉得 ,1
周到 快捷 服务 细致 送餐 非常 ,1
不断 不错 予以 入住 反馈 提供 提出 提高 改善 改进 更加 服务 着想 考虑 设置 进行 ,1
不可以 不满 光临 入住 再次 反馈 安排 录入 期待 比较 沟通 满意 直接 表示歉意 要求 造成 遗憾 首先 ,1
下榻 不到 不断 再次 升级 反馈 完毕 就是 已经 希望 提高 改造 继续 装修 运营 进行 逐层 ,1
估计 好了 就餐 真的 ,1
不错 实惠 就是 ,1
便于 免费 入座 反映 宽敞 延长 引导 很快 惊喜 想法 感动 打车 提醒 搞定 收看 方便 服务 查找 没住 清凉 清理 登记 离开 设有 试试看 轮渡 较晚 还有 进行 退房 送上 送至 随时 ,1
一直 不错 位置 升级 大连 希望 比较 翻新 装修 设备 进行 靠近 ,1
一定 不错 了了 便利 免费 入住 升到 升级 呵呵 好像 就是 很好 打理 没有 热闹 申请 看电视 表扬 见到 觉得 记住 超大 超好 退房 遗憾 随口 非常 非常好 靠在 马上 ,1
不耐烦 不错 丰富 例如 便利 可能 周到 喜欢 妥贴 宽敞 年轻 开关 得很 打车 控制 改进 方便 明显 服务 比较 温暖 生意 用过 舒服 轮渡 还好 非常 ,1
入住 整洁 服务 略显 ,1
一定 不错 双早 喜欢 宽敞 干净 方便 服务 舒适 起步 轮渡 还有 非常 ,1
不远 不错 微笑 方便 服务 相当 真诚 ,1
不错 丰富 判断 应该 挂牌 比较 重要 ,1
服务 装修 ,1
不错 丰富 值得 服务 满意 ,1
便于 免费 入座 反映 宽敞 延长 引导 很快 惊喜 想法 感动 打车 提醒 搞定 收看 方便 服务 查找 没住 清凉 清理 登记 离开 设有 试试看 轮渡 较晚 还有 进行 退房 送上 送至 随时 ,1
一定 不错 了了 便利 免费 入住 升到 升级 呵呵 好像 就是 很好 打理 没有 热闹 申请 看电视 表扬 见到 觉得 记住 超大 超好 退房 遗憾 随口 非常 非常好 靠在 马上 ,1
一般 倒是 有如 服务 没有 经营 ,1
不耐烦 不错 丰富 例如 便利 可能 周到 喜欢 妥贴 宽敞 年轻 开关 得很 打车 控制 改进 方便 明显 服务 比较 温暖 生意 用过 舒服 轮渡 还好 非常 ,1
入住 整洁 服务 略显 ,1
一定 不错 双早 喜欢 宽敞 干净 方便 服务 舒适 起步 轮渡 还有 非常 ,1
不远 不错 微笑 方便 服务 相当 真诚 ,1
不错 丰富 判断 应该 挂牌 比较 重要 ,1
服务 装修 ,1
不错 丰富 值得 服务 满意 ,1
一次性 原来 希望 提供 没有 继续 ,1
不远 不错 实惠 方便 服务 比较 ,1
一定 不让 便利 保管 即可 可能 好吃 差别 幸好 拔掉 最新 有密 永久 用来 盗走 装修 要用 进行 配有 配置 ,1
不错 便宜 入住 更加 继续 ,1
不错 位置 配有 ,1
不错 就是 装修 ,1
一般 不畅 不远 不错 便利 比较 粗糙 装修 超市 高速 ,1
不太好 位置 合理 比较 满意 特别 知道 ,1
不大 ,1
上网 不会 不知 不足 不错 仔细 保护 值得 入住 共有 其实 再三 冷静 出现 分别 加快 加油 包括 发现 发癫 只好 吵架 咨询 回来 处理 好像 好在 存在 完全 完毕 导致 尤其 就是 居然 希望 帮忙 开到 开始 当然 打车 报错 招待 接受 接待 推荐 提前 提示 提过 提醒 改进 方便 无视 明显 是否 服务 比较 直冲 看下 看来 看看 知道 统计 耽误 要求 计算 设备 说话 购大 赶回 转帐 送达 遇到 频繁 ,1
上网 不错 免费 ,1
服务 ,1
一般 希望 改进 服务 相当 相符 进一步 ,1
位于 值得 出来 吃饭 宽敞 尤其 提示 方便 服务 热闹 觉得 贴心 送来 选择 逛街 配有 非常 ,1
不错 位置 入住 再次 很大 方便 考虑 重要 ,1
不到 不少 位置 使用 出去 出来 升为 对得起 工作 引导 服务 正好 比较 没有 点评 留下 稍微 至少 补充 非常 非常好 ,1
不错 丰盛 很大 服务 ,1
上网 不错 推荐 欣赏 比较 相当 简单 至少 进行 非常好 ,1
一定 上网 免费 却是 坚持 奢华 宽敞 就是 开灯 很快 接待 有着 服务 破烂 绝对 舒服 装修 退房 送到 非常 ,1
上网 不会 不知 不足 不错 仔细 保护 值得 入住 共有 其实 再三 冷静 出现 分别 加快 加油 包括 发现 发癫 只好 吵架 咨询 回来 处理 好像 好在 存在 完全 完毕 导致 尤其 就是 居然 希望 帮忙 开到 开始 当然 打车 报错 招待 接受 接待 推荐 提前 提示 提过 提醒 改进 方便 无视 明显 是否 服务 比较 直冲 看下 看来 看看 知道 统计 耽误 要求 计算 设备 说话 购大 赶回 转帐 送达 遇到 频繁 ,1
上网 不错 免费 ,1
服务 ,1
一般 希望 改进 服务 相当 相符 进一步 ,1
位于 值得 出来 吃饭 宽敞 尤其 提示 方便 服务 热闹 觉得 贴心 送来 选择 逛街 配有 非常 ,1
不到 不少 位置 使用 出去 出来 升为 对得起 工作 引导 服务 正好 比较 没有 点评 留下 稍微 至少 补充 非常 非常好 ,1
倒是 免费 升级 听说 显得 比较 没有 经常 豪华 较大 遇到 ,1
不错 丰盛 很大 服务 ,1
上网 不错 推荐 欣赏 比较 相当 简单 至少 进行 非常好 ,1
一定 上网 免费 却是 坚持 奢华 宽敞 就是 开灯 很快 接待 有着 服务 破烂 绝对 舒服 装修 退房 送到 非常 ,1
不会 不太好 不好 不小 估计 就是 很大 才能 等到 调节 ,1
不错 好像 记得 ,1
倒是 入住 勤快 可惜 就是 帮忙 开车 服务 比较 特别 知道 表扬 ,1
不错 位置 入住 出行 应该 方便 非常 ,1
入住 反馈 接待 提供 服务 欢迎 漏送 看到 获赠 补送 表示 赠送 造成 预订 首先 ,1
有的 满意 简单 ,1
干净 很快 整洁 服务 退房 ,1
一直 不错 位置 升级 大连 希望 比较 翻新 装修 设备 进行 靠近 ,1
不错 挺好吃 方便 还有 ,1
不到 不足 吸引 实惠 就是 应该 据说 比较 豪华 非常好 ,1
不会 不太好 不好 不小 估计 就是 很大 才能 等到 调节 ,1
不错 好像 记得 ,1
倒是 入住 勤快 可惜 就是 帮忙 开车 服务 比较 特别 知道 表扬 ,1
不错 位置 入住 出行 应该 方便 非常 ,1
入住 反馈 接待 提供 服务 欢迎 漏送 看到 获赠 补送 表示 赠送 造成 预订 首先 ,1
有的 满意 简单 ,1
干净 很快 整洁 服务 退房 ,1
不错 挺好吃 方便 还有 ,1
一般 倒是 有如 服务 没有 经营 ,1
不到 不足 吸引 实惠 就是 应该 据说 比较 豪华 非常好 ,1
不错 亲切 优惠 回来 大约 徒步 打车 正好 真是 赶上 非常 ,1
不错 亲切 优惠 回来 大约 徒步 打车 正好 真是 赶上 非常 ,1
不好 不错 入住 其实 吃饭 合适 寒碜 就是 应该 愿意 打车 方便 服务 比较 没有 觉得 起步 ,1
便利 尚可 就是 提供 比较 ,1
,1
不在 出差 比较 还好 ,1
付账 好在 方便 比较 点评 补充 ,1
比较 缺少 还好 非常好 ,1
不会 付账 很大 方便 点评 补充 ,1
不错 便宜 入住 更加 继续 ,1
不错 好像 忘带 挺快 服务 ,1
入住 加强 反馈 吸烟 处理 已经 开始 得到 找到 敬请 无烟 没有 特别 紧张 继续 谅解 重视 需求 预订 ,1
位置 入住 处理 已经 强调 得到 打败 换成 无烟 点名 真真 知道 确认 试探 非常 预定 ,1
好像 据说 最贵 还好 ,1
可能 比较 突出 ,1
方便 满意 ,1
改善 没房 还有 需要 ,1
出去 适合 ,1
一定 上写 不行 不错 不靠 休闲 免费 入住 有名 没有 满意 相当 看到 装修 还有 非常 ,1
估计 实在 才能 打开 比较 ,1
一般 上网 不错 位置 免费 刚好 加班 就是 干净 想想 没有 点评 能够 补充 还算 ,1
不错 位置 入住 再次 很大 方便 考虑 重要 ,1
入住 加强 反馈 吸烟 处理 已经 开始 得到 找到 敬请 无烟 没有 特别 紧张 继续 谅解 重视 需求 预订 ,1
位置 入住 处理 已经 强调 得到 打败 换成 无烟 点名 真真 知道 确认 试探 非常 预定 ,1
好像 据说 最贵 还好 ,1
可能 比较 突出 ,1
方便 满意 ,1
改善 没房 还有 需要 ,1
出去 适合 ,1
一定 上写 不行 不错 不靠 休闲 免费 入住 有名 没有 满意 相当 看到 装修 还有 非常 ,1
估计 实在 才能 打开 比较 ,1
一般 便宜 决定 加上 发现 可能 找到 明牌 服务 生意 由於 相差 考虑 自助餐 良好 走进 非常 马上 ,1
倒是 免费 升级 听说 显得 比较 没有 经常 豪华 较大 遇到 ,1
一般 不算 先订 再续 变成 可能 城订 处理 实在 居然 很好 很小 愉快 携城 改住 满意 点评 续订 补充 还有 非常 预定 ,1
不错 升级 只好 愉快 担保 没有 管理 ,1
周到 服务 确实 缺乏 ,1
应该 提升 服务 符合 ,1
不错 符合 ,1
入住 极为 清洁 照常 特别 难看 ,1
不敢 不错 位置 太慢 对骂 就是 服务 调解 退房 ,1
不错 位置 失望 希望 平平 早点 更新 没有 特别 表现 装修 ,1
一般 便宜 决定 加上 发现 可能 找到 明牌 服务 生意 由於 相差 考虑 自助餐 良好 走进 非常 马上 ,1
一般 不算 先订 再续 变成 可能 城订 处理 实在 居然 很好 很小 愉快 携城 改住 满意 点评 续订 补充 还有 非常 预定 ,1
一般 位于 位置 ,1
不错 升级 只好 愉快 担保 没有 管理 ,1
周到 服务 确实 缺乏 ,1
应该 提升 服务 符合 ,1
不错 符合 ,1
入住 极为 清洁 照常 特别 难看 ,1
不敢 不错 位置 太慢 对骂 就是 服务 调解 退房 ,1
不错 位置 失望 希望 平平 早点 更新 没有 特别 表现 装修 ,1
不能 不错 休息 位置 免费 入住 出差 努力 升级 反馈 可惜 告知 失望 就是 影响 感谢 提供 提高 旅游 最好 服务 未退 朴实 欢迎 相当 表扬 覆盖 解渴 起来 路过 进去 送来 重要 非常 马上 ,1
不好 不错 出门 周到 干净 开始 惊喜 愉快 担心 整洁 服务 没有 看到 看来 真的 竟然 靠近 ,1
上网 上说 下定 不好意思 不愁 不错 亲切 亲自 优越 便利 停业 偶也 入住 其实 出于 分到 到处 反应 反映 发现 可惜 合适 后悔 告诉 大概 大肆 好了 对应 尤其 居然 已经 很大 打开 打算 提供 提醒 改善 放弃 放水 教唆 早点 显得 更好 服务 极少 欢迎 没得 没有 注意 渐进 滚动 点评 登录 看来 看看 真快 知道 解决 说出 进入 进去 重要 非常 顿时 预定 马上 ,1
上网 不错 打开 改善 ,1
不太好 提供 服务 没有 洗完 洗澡 点评 舒服 补充 还有 送到 隔离 ,1
一般 不错 免费 发生 就是 并未 意外 打车 接车 提供 无证 服务 涉嫌 经营 耽搁 送到 ,1
入住 吃住行 方便 适合 ,1
入住 出差 到达 周到 很迟 得很 服务 细致 非常 ,1
便利 就是 竟然 ,1
只好 夸张 就是 真是 睡不着 穿上 竟然 退房 ,1
便利 就是 竟然 ,1
只好 夸张 就是 真是 睡不着 穿上 竟然 退房 ,1
不慎 不菲 免费 可口 干净 感动 收拾 放心 送回 遗忘 ,1
不大 只值 干净 影响 整齐 的确 ,1
不远 不错 便利 已经 干净 很大 挂牌 方便 显得 服务 正式 比较 ,1
上網 不錯 之餘 位置 住入 侷促 停車場 價格 免費 協助 友善 同意 吸引 嘉許 堅持 奉來 委實 寬敞 平心而論 恰當 態度 推介 提供 方便 有禮 服務 服務員 機構 溫文 潔淨 火車站 点评 空間 簡直 綠化 網友 置評 考慮 舒適 良好 花園 衛生 补充 視野 設備 謝謝 豪華 超值 足夠 踏實 迅速 適中 餐廳 ,1
不错 属于 比较 还有 ,1
一般 入住 宽敞 服务 觉得 ,1
一般 不好 位置 其实 只能 更好 服务 来讲 相信 真的 选择 非常 ,1
不错 便宜 应该 ,1
可说 应该 没有 ,1
便宜 比较 相对 ,1
不错 偶尔 出行 打折 服务 比较 痛苦 觉得 设备 ,1
不到 不错 入住 没有 荒凉 还有 预定 ,1
不错 厉害 提高 比较 维护 进出 需要 ,1
上网 不到 不错 大连 就是 干净 感到 提出 方便 服务 根本 没有 给换 ,1
不错 便宜 应该 ,1
可说 应该 没有 ,1
便宜 比较 相对 ,1
不错 偶尔 出行 打折 服务 比较 痛苦 觉得 设备 ,1
不到 不错 入住 没有 荒凉 还有 预定 ,1
不错 厉害 提高 比较 维护 进出 需要 ,1
一般 不好 不算 不远 不错 位置 入住 出门 品尝 就是 影响 敏感 方便 服务 舒服 良好 ,1
可能 多加 完全 就是 必要 比较 ,1
不错 优越 服务 选择 ,1
不符 不错 免费 卫生 听到 就是 提供 比较 ,1
上网 不好 不远 不错 免费 居然 希望 收到 方便 服务 清晰 繁华 要大 觉得 ,1
不错 位置 修好 已经 接到 服务 没有 装修 ,1
上网 不在 不好 不错 丰富 免费 入住 反映 发现 取消 困难 完全 当然 恐怖 打车 方便 服务 比较 没有 点评 甚至 的确 相比 真正 确实 立刻 紧张 舒服 选择 预订 ,1
一向 一直 停车 免费 合理 回到 工作 已有 忙碌 旋转 最好 服务 正中 清爽 满意 牙刷 舒服 长住 非常 ,1
其实 ,1
免费 升级 原先 很灵 旋转 服务 没有 非常好 预定 ,1
就是 展会 满意 离新 ,1
到位 喜欢 服务 非常好 ,1
不错 列入 就是 很大 服务 正大 相对 相差 说离 ,1
不敢 不错 出来 发现 就是 应该 推门 方便 服务 没有 游泳 漂亮 看书 看到 稍微 训练 试试 非常 非常好 ,1
一律 不错 倒是 入住 刚刚 发呆 呵呵 回来 坐在 大概 就是 很大 愧对 打开 方便 无疑 更是 最美 没事 没有 离开 稳定 起步 选择 ,1
不错 便利 入住 合适 大连 就是 干净 很大 打开 整洁 极为 查房 熟练 退房 ,1
比较 管理 维护 ,1
不会 不错 免费 升级 尤其 就是 影响 施工 服务 睡眠 还好 面对 ,1
不到 不够 不好 不灵 不远 不错 亮丽 供应 倒是 倾向 偏离 入住 制止 印有 发筋 只能 可能 好像 好玩 应急 应该 径直 感应 打车 把握 抽烟 据说 无烟 普遍 服务 比较 洞开 点评 确实 稍微 结束 缺少 补充 还有 还给 进口 选择 ,1
一期 不好 不行 入住 到底 可爱 大概 居然 开心 异常 很小 很快 想起 打到 晓得 有点累 服务 比较 等待 等来 转身 送来 需要 ,1
下水 不通 不错 修好 免费 入住 加强 升成 发觉 堵塞 大致 差一点 比如 满意 维修 ,1
不错 丰富 居然 方便 服务 比较 还好 还有 ,1
不错 倒是 没有 洗澡 稍微 繁华 觉得 随时 ,1
尤其 干净 很大 很足 服务 舒适 ,1
不错 吃饭 方便 服务 逛街 ,1
停车 ,1
上网 不错 位置 便宜 入住 吃饭 大连 实在 容易 宽敞 开始 找到 方便 正常 比较 特别 犹豫 适合 ,1
喜欢 带有 服务 比较 ,1
不错 丰富 便宜 反映 尝尝 相当 自助 订过 ,1
入住 再次 ,1
不错 便宜 吃饭 好找 干净 方便 比起 稍差 考虑 舒适 还算 ,1
