改善 非常 ,0
入住 开会 推荐 无烟 比较 没有 简陋 非常 ,0
一直 上订 不会 不好 不爽 不行 也敢 入住 再也 再有 决定 出来 加钱 发现 发生 可能 告知 告诉 喜欢 坚持 多加 好了 实在 就是 干净 影响 很小 很烂 很脏 打到 抓痒 拿出 接待 携城 日本人 显得 有没有 没有 相关 真是 睡觉 知道 离开 签约 糟糕 索赔 给钱 考虑 舒服 要钱 觉得 豪华 还好 进去 逃出 逮住 非常 麻烦 ,0
一直 上订 不会 不好 不爽 不行 也敢 入住 再也 再有 决定 出来 加钱 发现 发生 可能 告知 告诉 喜欢 坚持 多加 好了 实在 就是 干净 影响 很小 很烂 很脏 打到 抓痒 拿出 接待 携城 日本人 显得 有没有 没有 相关 真是 睡觉 知道 离开 签约 糟糕 索赔 给钱 考虑 舒服 要钱 觉得 豪华 还好 进去 逃出 逮住 非常 麻烦 ,0
,0
不能 习惯于 出差 听说 希望 感受 愿意 成为 提供 改进 替来 服务 沦落 点评 狡辩 直接 约定 补充 要求 觉得 评为 ,0
不能 提供 注意 真是 ,0
介绍 免费 加水 就是 提供 提意见 没有 狡辩 还有 非常 非常好 ,0
不可以 交涉 入主 入住 准备 加收 务必 告诉 固定 已经 投诉 接待 放下 无礼 没用 生讲 知道 确认 简直 蛮横 要求 设定 预订 ,0
不可以 交涉 入主 入住 准备 加收 务必 告诉 固定 已经 投诉 接待 放下 无礼 没用 生讲 知道 确认 简直 蛮横 要求 设定 预订 ,0
不好 估计 就是 干净 显得 真是 非常 ,0
一直 入睡 反应 提前 退房 预计 ,0
不会 吸引 失望 感到 服务 肯定 非常 ,0
不予 入住 刺鼻 尤其 推荐 确认 积分 累计 装修 过道 ,0
一般 严重 入住 准确 怀疑 打来 拿到 摆平 真对 踏实 非常 ,0
一般 上网 不好 不少 不开 不爽 入住 几乎 只好 可能 吃饭 堵上 大约 尚可 居多 工作 应该 打开 抢钱 拖走 拿走 放在 正好 没有 点评 知道 竟然 简直 补充 装修 超过 轰鸣 过道 运转 通知 道歉 ,0
不想 丢人 亲自 休息 入住 再一次 再来 办完 堪称 居然 想到 手续 打不开 折腾 推荐 最差 没灯 满意 疲倦 终于 要求 进屋 露天 ,0
不想 丢人 亲自 休息 入住 再一次 再来 办完 堪称 居然 想到 手续 打不开 折腾 推荐 最差 没灯 满意 疲倦 终于 要求 进屋 露天 ,0
居然 杀猪 ,0
当然 旅游 没有 相当 简陋 非常 预定 ,0
一小 不住 不问 停电 原来 告诉 多加 打听 按摩 更换 最差 服务 没有 点评 特别 行为 补充 讨论 设备 说坏 赶出来 通知 ,0
不好 催促 动辄 只给 告知 坚决 好像 开光 快点 服务 比如 甚至 简陋 算命 需要 非常 ,0
入住 发现 可气 吃剩 吃饭 干净 收到 没有 还有 还给 退房 非常 预定 ,0
很大 选择 ,0
入住 只能 固定 培养 实在 就是 打折 没有 注重 真是 简直 起来 辛苦 退房 ,0
不来 仍然 出来 卫生 发现 已经 干燥 开会 打开 打扫 打死 指定 放在 放水 是露 服务 极为 检查 没看 洗完 登记 知道 诚心 达到 ,0
像是 出行 实在 开始 方便 比较 看上去 简直 简陋 觉得 ,0
不再 介绍 作为 健身 发表 可能 娱乐 已有 拥有 服务 根本 没有 确实 配套 ,0
不会 不错 估计 作为 入住 制服 回到 失望 就是 当到 据说 最多 最好 服务 没有 知道 简单 走去 转弯 进出 ,0
一定 上当 免费 取消 提供 最懒 最脏 有生 没停 点评 相信 补充 ,0
严重 休息 入住 反馈 吵闹 吵闹声 安装 影响 很大 得到 提出 改善 期待 紧邻 装修 进行 非常 ,0
不能 使到 变得 可能 夸张 安全 常住 很杂 打牌 方便 绝对 还好 进出 进去 进进出出 ,0
,0
不住 再也 吓人 根本 没有 起来 ,0
不大 不能 保卫 先要 入主 入住 出入 回房 外出 希望 开门 按时 提交 有效 服务 查看 没有 没电 满意 狡辩 答复 自由 表示 进门 违法 限制 需要 ,0
不住 不能 修理 入住 反正 发黄 坏掉 就是 居然 已经 开对 才能 更换 极度 根本 没有 没法 洗澡 留下 留有 相当 糟糕 脱掉 舒服 ,0
位置 偏僻 ,0
不大 不能 保卫 先要 入主 入住 出入 回房 外出 希望 开门 按时 提交 有效 服务 查看 没有 没电 满意 狡辩 答复 自由 表示 进门 违法 限制 需要 ,0
位置 偏僻 ,0
做法 免费 到处 回复 得到 更好 没有 通往 ,0
上锁 不到 出自 安全 实在 居然 已经 最差 极其 正门 没有 测门 简陋 ,0
位置 糟糕 还好 ,0
一般 不住 不少 反映 实在 就是 帮忙 应该 忍不住 招呼 明显 最长 有始 没有 点评 看到 管理 要不 设备 象见 跟不上 ,0
位置 刺鼻 吵闹 奇慢 方便 施工 适中 非凡 ,0
不再 停车 光临 入住 再次 出来 剩余 反馈 可供 完全 实在 尊敬 希望 怕怕 方便 永远 没法 深表歉意 解决 还有 选择 遇到 非常 首先 ,0
不快 光临 再次 反馈 可能 回复 尊敬 希望 度过 接触 服务 期待 深表歉意 满意 相当 真诚 知道 算不算 美好 遇到 ,0
一般 不好 不错 亟待 却是 摔下去 改善 服务 相比 装修 ,0
不能 使用 接受 难以 ,0
一般 不住 从来没 位置 坚决 尤其 简直 非常 ,0
入住 就是 没有 点评 ,0
一直 不能 不行 入住 关不上 告知 告诉 完餐 就餐 投诉 拿走 新来 无烟 最低 有没有 消费 理解 知道 跟着 ,0
不到 出去 出租 发生 告诉 拦到 提出 随时 ,0
一般 入住 当然 怀疑 愿意 更加 没有 点评 牵强 痛苦 真的 简直 糟糕 还有 配备 难吃 非常 鲜榨 ,0
一般 入住 当然 怀疑 愿意 更加 没有 点评 牵强 痛苦 真的 简直 糟糕 还有 配备 难吃 非常 鲜榨 ,0
位置 再来 寄到 寄去 找到 ,0
不住 再也 服务 留下 还有 ,0
住满 发现 发黄 发黑 熟悉 ,0
一大 不好 入住 其实 告知 想要 施工 没得 离开 表演 ,0
一定 不好用 便宜 充满 入住 发霉 只好 后悔 实在 已经 强烈 打算 据说 极度 根本 活动 要命 ,0
服务 没有 真的 考试 阴暗 ,0
一直 不可 入住 出去 出现 助理 只好 只能 吃饭 告诉 就是 开始 开车 忍受 悦要 抬高 搞错 没有 满意 等到 简单 觉得 订下 预定 预约 ,0
不算 入住 冤透 告知 多付 就要 挨冻 服务 真是 赶到 避免 郁闷 ,0
一直 不可 入住 出去 出现 助理 只好 只能 吃饭 告诉 就是 开始 开车 忍受 悦要 抬高 搞错 没有 满意 等到 简单 觉得 订下 预定 预约 ,0
不算 入住 冤透 告知 多付 就要 挨冻 服务 真是 赶到 避免 郁闷 ,0
一直 上网 不会 不想 不用 不能 不错 交涉 仍然 便宜 入住 加钱 告知 已经 干净 投诉 接通 提供 提出 搬到 根本 看起来 调换 豪华 进去 退房 ,0
不会 剩下 包含 堵塞 干净 更是 没到 没有 符合 结束 自助 设备 还有 靠近 ,0
一直 不敢 不耐烦 为先 估计 保证 做好 入住 再次 努力 反映 反馈 只好 召开 回复 培训 就是 就算 就让 工作 已经 希望 忍受 恶劣 批评 投诉 提高 教育 服务 期待 极其 树立 比较 点评 真诚 知道 碰到 立刻 致歉 补充 进行 退房 ,0
不爽 不肯 付款 保证 做好 再次 刷完 副理 努力 反映 反馈 发出 只得 召开 号称 回去 回复 回答 培训 处罚 尤其 就当 就是 工作 希望 帮助 应该 开始 当然 很大 愉快 感到 愤怒 扔到 批评 拍到 接待 提升 提高 改善 教育 旅游 服务 欣慰 正常 比较 点评 特别 生财 留存 登记 的确 看到 看过 真是 真诚 碰到 立刻 签字 管理 继续 致歉 补充 认识 说明 趴在 较差 进入 进行 送到 选择 道歉 重视 随后 需要 预定 ,0
一般 介绍 方便 比较 霉变 ,0
不合格 估计 保留 保证 入住 几乎 剔除 剥落 定期 已损坏 已经 才能 推荐 更新 服务 没有 瘫痪 筛选 较大 进行 ,0
不好 不能 从来没 似乎 发现 吵闹 很小 很硬 接到 接受 服务 没有 满意 睡懒觉 通知 闷热 非常 ,0
同样 相差 ,0
一般 了解 入住 合作 同样 已经 很大 脱离 豪华 较为 ,0
可恶 吃饭 唯独 实在 封死 开始 登记 ,0
可恶 吃饭 唯独 实在 封死 开始 登记 ,0
下咽 不能 买回 付费 使用 供电 值得 停电 免掉 入住 再次 冤枉 切换 反馈 发现 取消 只能 启动 备用 失望 奇妙 好在 安全 应急 恢复 承认 担心 拒绝 提供 显示 更加 查房 没了 没有 深刻 点播 看着 自动 自助 舒服 表示歉意 要收 要求 观看 解释 赶上 超过 道歉 防火 难以 首先 ,0
一般 下班 不会 不少 不敢 不能 估计 值班 入住 再好 冲凉 参与 并未 挂牌 掉下来 提前 改造 早就 服务 没用 注明 睡不着 竟然 肯定 说明 转到 非常 ,0
一直 不错 入住 ,0
就是 显得 比较 看上去 纯粹 ,0
就是 显得 比较 看上去 纯粹 ,0
省得 糟糕 ,0
一直 不妨 入住 其实 反映 很大 推出 推荐 比较 点评 相差 认为 ,0
不好 保留 先是 光临 入住 再次 加强 反馈 发生 告知 告诉 困扰 培训 失望 尊敬 就是 希望 愤怒 抱歉 担保 提高 早就 最终 期待 没房 看到 真的 确认 竟然 简直 表示 评为 还有 进到 退房 造成 避免 非常 ,0
不了 优惠 偏贵 免费 加上 反馈 可能 就是 已经 希望 所住 支持 更正 最少 比较 给予 继续 设计 需要 首先 ,0
一般 不到 反馈 可能 喜好 喜欢 希望 很小 很杂 支持 没有 真的 给予 谅解 ,0
失望 奇怪 就是 最多 真是 还有 送错 非常 ,0
一般 实在 就是 很贵 无意 正好 特别 看上去 看到 ,0
,0
不好 休息 干净 方便 比较 ,0
上当 不能 事先 告知 打算 没有 确认 设置 麻烦 ,0
一定 一般 不可以 不太好 不好 不能 制冷 就是 服务 极为 没剩 点评 简单 经常 补充 ,0
一般 服务 ,0
一次性 位置 入住 到位 完全 实在 就是 开门 服务 没换 没有 清洁 ,0
居然 没有 确认 预定 ,0
居然 没有 确认 预定 ,0
一般 低于 包括 属于 服务 紧临 ,0
上网 没有 竟然 ,0
不会 不能 不错 以致于 卫生 只能 安全 忍受 时不时 服务 浓烈 瘙痒 睡觉 进门 选择 重要 闻到 预订 ,0
一定 不到 不想 交接 再三 再也 却说 已经 快捷 收到 新开 方便 服务 根本 正好 没有 甚至 真的 确实 确认 耐心 躲避 非常 预定 ,0
一定 不到 不想 交接 再三 再也 却说 已经 快捷 收到 新开 方便 服务 根本 正好 没有 甚至 真的 确实 确认 耐心 躲避 非常 预定 ,0
不肯 不见 停工 入睡 居然 巨大 开始 施工 等到 苦苦 ,0
出去 包烟 寄放 打包 服务 相反 算不算 自营 要求 较烂 ,0
估计 入住 加收 发现 后悔 实在 居然 没住 没有 看见 还有 退房 逛街 鄙视 ,0
不好 位置 入住 决定 已经 手续 肯定 装修 进入 ,0
不理 似乎 忙碌 比起 略有 非常 ,0
严重 作为 保证 做到 卫生 同样 失望 好在 导致 干净 平庸 接水 提供 整洁 更好 服务 来到 清爽 点评 相形 知道 立即 繁华 考虑 补充 觉得 设计 过得去 还有 进行 连锁 高低 ,0
出去 包烟 寄放 打包 服务 相反 算不算 自营 要求 较烂 ,0
不好 位置 入住 决定 已经 手续 肯定 装修 进入 ,0
不理 似乎 忙碌 比起 略有 非常 ,0
严重 作为 保证 做到 卫生 同样 失望 好在 导致 干净 平庸 接水 提供 整洁 更好 服务 来到 清爽 点评 相形 知道 立即 繁华 考虑 补充 觉得 设计 过得去 还有 进行 连锁 高低 ,0
一般 不住 不能 便宜 失望 简直 肯定 ,0
不能 可觉 居然 最好 没待 看完 解决 ,0
一般 不到 竟然 送餐 选择 非常 ,0
一定 一般 上网 不会 不做 不够 不知 不能 享受 从没 使用 便利 保卫 保证 值得 入住 出口 到达 发生 失误 安全 安装 就是 尽职 帮助 开门 必要 忍受 感受 承诺 接待 推荐 放在 明显 更换 服务 松动 比较 没有 没见 稳定 简陋 综述 考察 表扬 要求 过道 追求 适处 遇到 铺设 防火 首先 ,0
一般 出差 好像 就餐 感受 极其 没有 装修 ,0
不能 可觉 居然 最好 没待 看完 解决 ,0
一定 一般 上网 不会 不做 不够 不知 不能 享受 从没 使用 便利 保卫 保证 值得 入住 出口 到达 发生 失误 安全 安装 就是 尽职 帮助 开门 必要 忍受 感受 承诺 接待 推荐 放在 明显 更换 服务 松动 比较 没有 没见 稳定 简陋 综述 考察 表扬 要求 过道 追求 适处 遇到 铺设 防火 首先 ,0
一般 出差 好像 就餐 感受 极其 没有 装修 ,0
不够 提供 服务 比较 甚至 相差 穿着 需要 ,0
反馈 唐山 回来 实在 ,0
不到 加上 加油 实在 希望 当然 恼火 服务 相差 选择 ,0
不到 加上 加油 实在 希望 当然 恼火 服务 相差 选择 ,0
入住 知道 ,0
几乎 后悔 很旧 最差 服务 真的 ,0
一般 不配 只能 可能 完全 实在 感冒 懒得 截流 最大 服务 没有 竟然 还好 遗憾 难吃 ,0
不能 丢人 入住 到达 吓跑 帮忙 很暗 愉快 招手 有损 服务 比较 理睬 真是 示意 竟然 繁华 连刷 难怪 非常 ,0
不能 丢人 入住 到达 吓跑 帮忙 很暗 愉快 招手 有损 服务 比较 理睬 真是 示意 竟然 繁华 连刷 难怪 非常 ,0
不好 不能 很大 考虑 装修 ,0
上网 入住 稳定 ,0
一般 很慢 ,0
不太好 不行 挺暗 进门 ,0
上锁 不知 使得 入住 其实 再订 原来 只好 告知 很大 有订 查到 没有 洗澡 竟然 要求 ,0
,0
一般 得了 豪华 ,0
不值得 不对 不符 不高 仍未 保证 值班 做到 入住 关闭 具备 再次 划掉 单薄 反应 反馈 发现 召集 回复 回应 培训 安排 安装 完全 实在 尊敬 工作 已经 希望 开会 很慢 得到 忘掉 找到 投诉 抱歉 拜访 指望 接到 接待 推荐 推迟 提出 提升 提及 支持 改成 更多 最大 最少 最最 服务 朦胧 树立 检查 永远 没有 注明 理解 直到 相关 着装 着重 睡眼 知道 确实 确认 离开 穿着 突然 简直 绝对 统计 肯定 至少 良好 营销 要命 要求 解决 询问 详细 说法 象审 象演 赠送 较好 达到 进行 连续 选择 顺利 预订 首先 ,0
不会 不想 入住 反馈 告诉 尊敬 愉快 提供 敬请 服务 ,0
不一定 不可能 不用 不能 严重 争取 亏待 亏损 作为 入住 其实 再次 出现 出租 原来 反馈 回复 回说 处理 安排 尊敬 带来 应变 应该 征用 得到 必须 怎能 愉快 才刚 打车 执行 接受 推说 提供 提早 支持 收到 改说 无关 晓得 最基本 期待 未有 查询 永不 活动 深感 特别 牺牲 真是 知晓 离开 竟然 能够 致电 荒谬 表示 要求 谅解 退房 透过 逗留 通知 道歉 遗憾 采用 难以 预定 预订 ,0
上挂 交涉 供应 免费 友好 培训 尊重 希望 应对 提供 擅自 有的 没有 结束 进入 进行 ,0
上当 值班 好在 有意 服务 欺诈 欺骗 没有 确认 ,0
上挂 交涉 供应 免费 友好 培训 尊重 希望 应对 提供 擅自 有的 没有 结束 进入 进行 ,0
上当 值班 好在 有意 服务 欺诈 欺骗 没有 确认 ,0
优胜 方便 混乱 ,0
上当 切勿 容易 巨窄 按说 没有 知道 设备 过于 ,0
一直 了近 从来 体察 何必 入住 再次 出差 发现 发生 口供 告知 回到 在场 处长 大约 好话 如入 希望 带回 弄坏 彻底 心目中 愿意 拨打 损坏 敬请 最终 极其 根本 栽赃 没有 注意 洗清 焚毁 看看 破损 立即 类似 耽误 肃清 能够 装修 要求 讹诈 询问 赔偿 赶到 还有 退房 透明 递烟 郁闷 野蛮 驾到 ,0
不住 冒出 加强 原来 妄图 打开 找到 推荐 教育 暗暗 更好 来住 注意 清楚 相信 看到 知道 繁荣 觉得 貌似 郁闷 ,0
分明 没有 清楚 ,0
漂亮 ,0
不肯 不错 倒贴 入住 务必 媲美 就是 恐怖 扑鼻 昏暗 没有 算有 累积 肮脏 长年 ,0
入住 入宿 出于 只能 吓人 已经 恐怖 换到 查阅 点评 ,0
漂亮 ,0
不肯 不错 倒贴 入住 务必 媲美 就是 恐怖 扑鼻 昏暗 没有 算有 累积 肮脏 长年 ,0
入住 入宿 出于 只能 吓人 已经 恐怖 换到 查阅 点评 ,0
一般 不会 免费 另加 奇贵 好像 最烂 绝对 舒服 觉得 ,0
一般 免费 就是 没有 特别 ,0
不会 作出 做法 再用 取消 只能 听任 堵车 好像 妥当 安排 就是 居然 已经 成交 投诉 推荐 撇得 显示 没有 清楚 用作 直到 知道 解释 达到 预定 ,0
不会 不到 不同 入住 再次 切防 只能 容忍 希望 找到 报销 提交 斩到 无名 核对 没有 理解 签字 绝对 随便 ,0
一边 不好 不错 光鲜 入住 几外 同样 回答 处理 实在 忍不住 放到 极其 直接 看到 突然 竟然 简直 赶时间 起来 退房 遇到 ,0
一边 不好 不错 光鲜 入住 几外 同样 回答 处理 实在 忍不住 放到 极其 直接 看到 突然 竟然 简直 赶时间 起来 退房 遇到 ,0
一直 不存在 也许 似乎 入眠 准备 可否 完美 尊重 尤其 应该 怀疑 感想 换来 无奈 特别 真诚 试想 足够 ,0
免费 入住 出门 完工 广大 收钱 方便 施工 注意 考虑 还有 ,0
免费 入住 出门 完工 广大 收钱 方便 施工 注意 考虑 还有 ,0
再三 刚刚 卫生 取消 受到 听到 呼吁 实在 就是 希望 快乐 恶劣 打到 承诺 按摩 接到 推广 提高 更多 服务 欺骗 没有 满意 点评 由衷 真是 糟糕 致歉 补充 觉得 诚恳 负责 还有 造成 避免 需要 非常 ,0
一般 上网 不会 不再 不比 免费 出行 实在 就是 才能 搭理 放下 方便 显示 最少 服务 欺骗 涉嫌 激活 还有 ,0
一般 上网 不会 不再 不比 免费 出行 实在 就是 才能 搭理 放下 方便 显示 最少 服务 欺骗 涉嫌 激活 还有 ,0
很烂 推荐 阴暗 ,0
下楼 休息 做法 已经 打表 更加 最多 服务 根本 没有 注意到 结算 自动 计算 说明 非常 ,0
一大 不好 入住 其实 告知 想要 施工 没得 离开 表演 ,0
不到 入住 勉强 实在 希望 必要 必须 撤单 核对 甚远 留下 相差 要求 认真 随时 ,0
下楼 休息 做法 已经 打表 更加 最多 服务 根本 没有 注意到 结算 自动 计算 说明 非常 ,0
不会 做出 入住 再次 反馈 安装 完毕 已经 希望 应该 很大 很烂 抱歉 提供 更多 正好 比赛 没有 潮湿 点拨 看到 绝对 让步 调试 还有 道歉 遗憾 错过 ,0
不止 反映 同样 应收 感冒 是订 服务 没有 特别 相比 糟糕 起床 ,0
不好 加上 吵得 整晚 睡眠 睡着 要命 ,0
不太好 不错 不高 位置 可能 号称 吃饭 吵杂 完美 干净 延迟 收钱 方便 结合 装修 觉得 退房 非常 ,0
不太好 不错 不高 位置 可能 号称 吃饭 吵杂 完美 干净 延迟 收钱 方便 结合 装修 觉得 退房 非常 ,0
一般 下雪 不敢 估计 出差 升级 哎呀 回来 坐上去 已经 开始 打不开 打开 掉牙 最差 服务 没有 湿湿 特别 甚至 看看 知道 腾腾 讨厌 还有 ,0
一般 下雪 不敢 估计 出差 升级 哎呀 回来 坐上去 已经 开始 打不开 打开 掉牙 最差 服务 没有 湿湿 特别 甚至 看看 知道 腾腾 讨厌 还有 ,0
不到 只能 强烈 推荐 放下 极小 根本 没了 赶不上 ,0
一直 停止 开始 提示 施工 有理 死人 没有 继续 解决 ,0
准备 只能 可能 吃饭 已经 想到 授权 提醒 提高 暂且不说 有待 比起 没有 真的 睡觉 硬是 确实 突然 竟然 签单 装修 配不上 重新 ,0
不到 只能 强烈 推荐 放下 极小 根本 没了 赶不上 ,0
一直 停止 开始 提示 施工 有理 死人 没有 继续 解决 ,0
位置 勉强 比较 ,0
不会 付费 位置 出入 加料 卫生 发现 取车 可见 吃饱 回到 就是 影响 恐怖 提供 方便 更为 服务 比较 没有 清洁 游荡 现烧 看见 真的 睡眠 竟然 经常 结束 要求 超大 过于 进门 需要 非常 预订 ,0
一定 一點 不會 偏僻 入住 已經 時候 服務 根本 沒人 沒有 為了 省錢 空調 誇張 這樣 風聲 ,0
一定 一點 不會 偏僻 入住 已經 時候 服務 根本 沒人 沒有 為了 省錢 空調 誇張 這樣 風聲 ,0
不太好 不能 大陸 就是 平安 您們 房間 推荐 會員 未曾 標準 正如 環境 生活 直立 窄小 老老實實 肥胖 見到 走動 車站 較遠 頭髮 顏色 ,0
一定 不够 不好 不错 介绍 位置 使用 入住 其实 发现 可怜 坐在 完美 实在 小于 居然 已经 干净 应该 恐怕 才能 推荐 放不下 服务 极尽 没有 漂着 点评 甚至 相差 看电视 研究 稍微 要求 见到 觉得 认为 进去 连坐 选择 需要 首先 ,0
一定 不到 入住 到达 同去 后悔 失望 服务 期待 比较 清楚 退房 ,0
不太好 不能 大陸 就是 平安 您們 房間 推荐 會員 未曾 標準 正如 環境 生活 直立 窄小 老老實實 肥胖 見到 走動 車站 較遠 頭髮 顏色 ,0
一定 不够 不好 不错 介绍 位置 使用 入住 其实 发现 可怜 坐在 完美 实在 小于 居然 已经 干净 应该 恐怕 才能 推荐 放不下 服务 极尽 没有 漂着 点评 甚至 相差 看电视 研究 稍微 要求 见到 觉得 认为 进去 连坐 选择 需要 首先 ,0
一定 不到 入住 到达 同去 后悔 失望 服务 期待 比较 清楚 退房 ,0
不到 服务 确实 绝对 ,0
一般 下楼 不能 善意 好像 必须 担心 提醒 查看 登记 等待 要求 靠近 预定 马上 ,0
不得不 充满 兑现 到达 或明或暗 承诺 潮湿 简直 糟糕 过道 闪烁 非常 预定 频繁 ,0
不象 简直 ,0
不象 简直 ,0
严重 复合 夹杂 没法 浓重 生存 简直 较差 麻烦 ,0
严重 复合 夹杂 没法 浓重 生存 简直 较差 麻烦 ,0
一直 一般 不少 便宜 倾斜 出来 原来 回去 就是 已经 方便 没有 洗完 洗澡 溅出 研究 老大 设计 超市 还有 ,0
不住 停车 免费 合作 嘈杂 就算 影响 最差 知道 竟然 简直 非常 ,0
一小 不会 不能 不见 互相 交涉 享受 仍未 任选 修改 入住 几乎 到达 原来 发现 同意 告诉 回房 坚决 失望 奇怪 实在 对此 就算 居然 已经 年轻 强烈 强调 归还 忍不住 忘记 愉快 感受 愤怒 扣住 承诺 担保 拒绝 拿到 换成 提出 摇头 改为 无敌 早就 是否 最终 有的 服务 查到 查过 根本 欢乐 沟通 没有 游泳 登记 直到 真是 真诚 知道 确认 突然 竟然 等待 简陋 算是 糟糕 自助餐 落实 表示歉意 要付 要求 解释 认识 询问 豪华 转去 退房 通知 道歉 鄙视 难道 露出 非常 预付 ,0
原来 告知 对此 改造 根本 没有 进行 预定 ,0
同意 后悔 没看 点评 看看 ,0
一般 上网 不能 休息 做饭 到达 安排 很远 才能 没法 穿过 闻到 非常 ,0
失望 比较 ,0
失望 比较 ,0
也许 副理 反映 反正 反馈 尊敬 尽力 希望 改善 方便 比较 点评 ,0
开通 没有 签名 要求 送来 ,0
不到 不用 从来 传真 发现 回来 在升 实际上 帮忙 挂来 更是 未经 查询 核对 根本 没有 消费 确认 竟然 签字 超市 还有 ,0
一大 一定 一般 下咽 不得 不得不 不补 为求 休息 估计 入住 出去 分配 勉强 发现 只好 只能 可恶 吃完 同意 后悔 告知 嘈杂 围拢 威胁 实在 封闭 干脆 开始 很小 很闹 得很 忍受 拆迁 提前 散发 施工 是否 最差 服务 极其 查询 没有 潮湿 看电视 紧紧 经常 给换 缩短 要求 说话 调换 豪华 身着 过道 返京 退房 选择 透过 难以 需要 非常 面对 鞠躬 ,0
估计 最差 ,0
一般 实在 就是 服务 比较 设计 ,0
上锁 不错 严肃 乖乖 先是 决不 出现 刺鼻 原样 变苦 只好 只能 失望 容易 尝尝 就是 巨大 希望 干净 应该 才能 撤回 明显 服务 没有 没法 没辙 简陋 终于 解释 还算 适合 重复 非常 顺便 首先 骚扰 麻烦 默念 ,0
交涉 入住 发霉 安排 居然 潮湿 长期 预订 ,0
不对 入住 到处 到达 反馈 失望 实在 已经 得成 晓得 致以 装修 解决 设置 诚挚 豪华 较晚 ,0
上进 下属 不会 不思 从没 入住 回复 培训 大连 好好 工作 干吗 改进 方便 有用吗 比如 永远 没借 看到 真的 绝对 考虑 该换 越来越 还有 ,0
不予 不会 不在 不好意思 不用 争论 作为 作用 保护 做到 入住 出来 到处 反馈 回来 安排 寄存 就是 居然 年轻 度假 当然 影响 想想 愿意 批评 承包 投诉 拜访 按摩 接受 提供 提出 提到 敲门 是以 更好 服务 来访 正好 正常 没有 没用 甚至 登记 监控 监视 看到 真的 确实 算了 管理 绝对 自备 舒适 访客 说明 进入 进行 退房 选择 透露 道歉 难得 难道 震惊 非常 首先 ,0
一定 不爽快 似乎 催问 入住 减少 加上 努力 反馈 好了 就是 已经 带来 影响 很烦 得到 得很 打不开 控制 提供 提到 插入 插进去 支持 改进 施工 显示 更好 最大 有效 服务 真诚 给予 继续 表示 要加 诚挚 跟踪 进行 退房 马上 ,0
不错 也敢 便宜 停在 出于 出入 刺鼻 发霉 变成 奉劝 好在 就是 居然 带有 开始 打开 扔进 拒绝 接近 没有 签约 自由 要求 说起 豪华 进入 退房 马上 ,0
复杂 懒散 方便 没有 选择 ,0
不下 不少 不想 不符 优惠 依稀 便宜 值得 公开 具备 出来 出游 反馈 发现 告诉 回来 实在 家住 尤其 就是 希望 影响 怀疑 打到 投诉 折扣 拍死 拿到 显示 最大 根本 甚至 直接 睡觉 简直 谈判 轻松 非常 预定 ,0
,0
出错 搞错 服务 ,0
一定 否則 房間 服務 比較 補充 說明 變為 雙人房 非常 預訂 ,0
