改善 非常 ,0
不敢 不用 副理 受过 培训 投诉 接待 极其 没完 没有 竟然 辩解 ,0
一觉 不错 关掉 发现 并洗 打开 打扫 方便 服务 比较 没有 管理 象是 ,0
不好 不能 原来 可怜 导致 打开 打折 拿到 没有 特贵 租出去 等到 简陋 综合 还有 采光 ,0
不好 不能 原来 可怜 导致 打开 打折 拿到 没有 特贵 租出去 等到 简陋 综合 还有 采光 ,0
入住 出差 可到 据说 要死 ,0
不会 不好 不能 反正 取消 变化 变更 就是 已经 必须 感谢 扣钱 承认 投诉 收到 根本 没去 没有 特别 理解 真的 答复 觉得 超市 选择 通知 遗憾 ,0
就是 找到 没有 绝对 ,0
不住 不够 免费 再也 副理 升级 反映 只能 告诉 坚决 就是 开会 故意 没有 直接 赶走 预定 ,0
严重 作为 居然 无烟 没有 登记 ,0
一般 上网 不会 不爽 作出 便宜 做出 入住 公布 准备 反馈 召开 处理 处罚 对此 届时 应该 很脏 提出 改为 明显 有损 极度 满足 特意 登入 相关 确实 调查 较脏 需求 非常 ,0
不好 不通 远离 ,0
不好 低于 入住 只能 嘈杂 应该 看到 算是 非常 ,0
下新 不错 也许 低廉 便利 入住 其实 发现 只能 同样 呵呵 喜欢 好好 学习 就是 希望 应该 恶劣 想着 提醒 搬去 改善 昏暗 更优越 有的 极其 正是 清楚 溜达 点评 看房 看门 竟然 简约 舒服 设计 赶紧 超值 超市 进去 连锁 退房 选择 顿时 预计 ,0
入住 强烈 推荐 有误 给出 ,0
不会 只能 就是 很差 比较 永远 没有 相距 看见 真是 退房 选择 ,0
位置 实在 很贵 配备 ,0
下不去 不住 容下 居然 很小 很脏 最差 服务 没有 没门 漫出 通道 ,0
失望 怀疑 ,0
听见 干净 很痒 惊醒 敲门 无比 最差 设备 转身 非常 ,0
下不去 不住 容下 居然 很小 很脏 最差 服务 没有 没门 漫出 通道 ,0
失望 怀疑 ,0
听见 干净 很痒 惊醒 敲门 无比 最差 设备 转身 非常 ,0
嘈杂 非常 ,0
修好 堵塞 折腾 没有 装修 ,0
嘈杂 非常 ,0
点评 相符 舒服 补充 ,0
不到 保准 入住 可怜 根本 没有 消毒 消退 知道 绝对 骚痒 ,0
不在 不敢 不着 保证 到处 勉强 只能 合作 名曰 当然 打到 打车 极其 正好 没有 看准 要不 赶上 进入 首先 ,0
原来 可能 宣传 很大 没有 ,0
不了 不会 不能 不错 交谈 保持 保证 先进 入住 再次 加强 反馈 发晕 发生 发霉 备用 存在 实在 居然 巡视 干燥 应该 很大 得去 忍住 感受 打死 掉落 改进 最大 最烂 没有 深表歉意 清爽 热烈 独立 结完 绝对 觉得 评上 足够 过道 还有 进门 选择 随便 震响 震惊 预留 首先 ,0
不敢 入住 很快 找钱 晕倒 服务 能到 还给 连声 送完 送餐 ,0
入住 成功 服务 真是 舒服 非常 预定 ,0
不行 ,0
有够 没有 真的 ,0
一般 不好 估计 倒底 关不掉 反掉 大概 干净 服务 极其 知道 ,0
允许 免费 好吃 实在 实惠 就是 就餐 最大 比较 重视 ,0
有够 没有 真的 ,0
允许 免费 好吃 实在 实惠 就是 就餐 最大 比较 重视 ,0
一早 下班 下雪 不剩 不好 不肯 不能 休息 传真 停电 傲慢 入住 出租 到达 协调 反应 受罪 可能 回应 奇怪 就是 已经 感冒 打扫 抬头 收拾 服务 没有 洗澡 点评 登记 看看 真的 知道 简直 管理 补充 询问 说明 起来 进入 锁起来 非常 预定 ,0
上放 凹陷 发现 吸烟 处有 无烟 服务 没错 绝对 预定 ,0
一般 不到 不算 位于 便宜 做为 停车 入住 卫生 只能 对待 服务 比较 特殊 睡得 竟然 维修 耽误 设备 退房 选择 ,0
一般 临近 交费 可能 合作 吵闹 服务 还好 长期 ,0
不好 不靠 保留 影响 提前 整晚 睡眠 预订 ,0
上加 上卖 不会 之多 事先 加以 原来 反应 发现 取电 可能 吃不完 就是 干净 很脏 方便 显得 根本 注意 知道 竟然 自动 要求 说明 进门 送到 靠背 ,0
一般 不到 不算 位于 便宜 做为 停车 入住 卫生 只能 对待 服务 比较 特殊 睡得 竟然 维修 耽误 设备 退房 选择 ,0
一定 不该 交涉 先是 入住 再也 出来 取消 大概 得去 恶劣 成功 扣款 授权 收到 最最 没有 直接 真的 真真是 自动 记得 适合 适宜 重新 ,0
一般 临近 交费 可能 合作 吵闹 服务 还好 长期 ,0
不好 不靠 保留 影响 提前 整晚 睡眠 预订 ,0
上加 上卖 不会 之多 事先 加以 原来 反应 发现 取电 可能 吃不完 就是 干净 很脏 方便 显得 根本 注意 知道 竟然 自动 要求 说明 进门 送到 靠背 ,0
不好 不足 個人 嚴重 就是 很暗 很爛 態度 房間 掛上 服務 標準 沒有 沒看 滲水 燈光 牆壁 登記 直說 知道 竟然 給換 覺得 還有 非常 首先 ,0
不好 不足 個人 嚴重 就是 很暗 很爛 態度 房間 掛上 服務 標準 沒有 沒看 滲水 燈光 牆壁 登記 直說 知道 竟然 給換 覺得 還有 非常 首先 ,0
包括 晕死 最烂 超出 超过 ,0
不了 不会 摆设 ,0
不少 减分 居然 有趣 睡觉 还好 进来 ,0
不会 不能 不行 修理 就算 居然 应该 当成 很小 明显 没有 狂晕 直接 考虑 要求 认识 预售 ,0
不会 不能 不行 修理 就算 居然 应该 当成 很小 明显 没有 狂晕 直接 考虑 要求 认识 预售 ,0
一直 一边 不明 不理 入住 到达 制服 发霉 大约 就是 当班 手续 服务 没有 确认 稍候 穿着 说订 难吃 首先 ,0
不会 不好 不问 免费 入住 吵得 应该 很小 排放 施工 最好 最差 直接 至少 装修 要命 非常 ,0
不畅 入住 排水 ,0
不停 位置 入住 出门 始终 完全 度假 很旧 推荐 整晚 服务 盘旋 看见 蹩脚 ,0
可能 方便 最差 服务 点评 补充 较远 ,0
上网 不理 不错 似乎 入住 恶劣 投诉 要求 ,0
一般 侮辱 出来 吓人 就是 提醒 搬出来 是否 服务 睡到 知道 给钱 舍得 要续 询问 ,0
不好 不少 不足 不错 出来 可见 失望 实际上 寄存 很大 正规 比较 没有 相差 看到 知道 管理 评上 象是 ,0
不会 不知 不符 打热 拒绝 服务 根本 要求 遭到 ,0
吵闹 安稳 就是 居然 投诉 服务 查看 没有 满意 特别 痛苦 相信 真的 知道 竟然 简直 要求 跑到 需要 非常 ,0
一定 一直 丰盛 倒是 像样 其实 出门 只能 吓人 在外 就是 已经 换到 放进 暴露 最烂 相对 看到 真得是 稍微 简装 终于 绝对 自助 装修 设备 设试 走道 还有 预定 预算 ,0
不够 从来 安排 实在 尤其 接待 显得 正面 没有 ,0
一凉 上放 下水 不到 不好 不好用 不爽 仓促 修理 出口 出来 到达 卫生 反正 发现 只好 听不懂 奇妙 好像 安分 尤其 已经 干净 当然 很慢 惊吓 提出 是从 更新 服务 期待 查看 正常 比较 没有 看到 看起来 睡觉 绕道 绝对 自觉 转到 连点 需要 饱受 ,0
一定 一直 不会 不好 不满 不知 不能 不行 不远 仓促 使用 免费 写明 出来 出门 加钱 厚实 只好 只能 可就 吵到 告知 喜欢 坐在 坦荡 塞住 就是 已经 应该 开始 弄坏 想想 想着 打扮 执意 挑选 掉下来 控制 撬出来 放上去 方便 查看 比较 没有 洗澡 看到 看重 真的 睡眠 穿梭 等于 算是 维修 肯给 表扬 要住 要求 谁知 走走 还有 选择 逛得 长久 ,0
一边 不了 不会 不错 出来 吃饭 同样 坚持 实在 就别 就是 干开 很快 得多 方便 早就 比较 没有 看得出来 看起来 真是 磨损 竟然 致电 躺下 非常 ,0
不好 不好用 嘈杂 很小 挂断 查询 洗漱 直到 等待 算了 ,0
好处 没有 破烂 ,0
一般 入住 发现 就是 服务 校办 ,0
严厉 出差 分为 分布 分开 尽快 希望 应该 愉快 投诉 损害 无关 没有 进行 遇到 重要 雄伟 ,0
不能 位置 入住 嘈杂 心急 服务 注明 稍微 装修 适合 ,0
一定 不能 伪满 好像 属于 恶劣 曲折 服务 苛求 要住 还有 阴暗 ,0
上网 不了 不可以 回答 必须 死活 没有 ,0
不好 入住 只能 睡觉 装修 豪华 起来 非常 ,0
不会 就要 据说 显得 翻修 跟着 ,0
一般 居然 服务 ,0
入住 太慢 收拾 服务 ,0
出错 居然 屡屡 服务 核对 认识 预留 ,0
一直 不会 不可能 不好 不成 依然 再次 反感 只好 可能 失望 对不住 开门 很贵 憧憬 折腾 抽烟 改进 放在 曾经 服务 没人 的确 睡着 睡觉 确实 美好 觉得 走不开 进房 难受 难道 非常 ,0
下榻 不好 享受到 休息 光临 入住 再次 创造 反馈 吵得 安装 尊敬 居住 工作 已经 广大 开始 忠肯 怀疑 恳请 感受到 打扰 抱歉 接洽 提出 改造 施工 更加 服务 未能 欲裂 深切 热诚 相信 睡不着 舒适 表示 表示歉意 装修 要求 进行 遵守 非常 顺利 ,0
上网 不会 免费 入住 反馈 增值 对此 尊敬 已经 带来 很大 改造 服务 欢迎 比较 深表歉意 秉承 竭诚 至上 装修 调整 赠送 进行 选择 ,0
一般 入住 告诉 服务 比如 比较 装修 认为 ,0
不好 出来 吃饭 就要 撤餐 没有 简直 ,0
不能 入住 几乎 危险 厉害 尽快 换掉 比较 真的 还有 进行 ,0
工作 已经 开门 敲门 看着 真是 进来 ,0
到处 很小 觉得 象是 ,0
不会 不停 不算 卫生 太慢 干净 比较 简陋 ,0
一般 不能 入住 几乎 发现 奇怪 尤其 搬到 是否 曾经 服务 比如 没有 疯狂 看到 真的 知道 确切 立刻 较差 需要 非常 ,0
不会 不停 不算 卫生 太慢 干净 比较 简陋 ,0
一般 不能 入住 几乎 发现 奇怪 尤其 搬到 是否 曾经 服务 比如 没有 疯狂 看到 真的 知道 确切 立刻 较差 需要 非常 ,0
一般 不到 不快 便宜 其实 告知 好了 开成 开错 新开 没错 送来 ,0
充电 勉强 就是 巨大 应用 挂牌 搞笑 根本 没有 竟然 装修 需要 顶多 ,0
最差 根本 没法 睡觉 ,0
不用 不知 不良 付钱 入住 好处 实在 就是 授权 方便 服务 比较 没有 知道 退房 选择 逛街 预订 ,0
上网 不会 不能 举动 使用 做出 关不上 关闭 发现 发霉 就是 居然 急于 打开 控制台 欠佳 正常 留下 留有 相信 绝对 维护 贸然 走进 还有 遇到 预定 ,0
发霉 实在 就是 开始 拉倒 服务 没有 睡着 简直 ,0
不会 休息 做法 入住 再次 影响 答复 紧靠 要求 调换 采取 隐瞒 非常 ,0
不住 再有 只能 放进 真的 绝对 被卧 非常 首先 ,0
一次性 不能 供应 入住 单独 参考 反映 反馈 安全 就是 希望 改进 服务 满意 点评 真正 竟然 补充 觉得 计入 说明 进步 退房 ,0
入住 已经 服务 越来越 ,0
不做 入住 冲凉 准备 包括 发生 合理 失望 实在 希望 平安 拔掉 摔倒 摔没 更是 沟通 没有 注意 诚意 赔偿 道歉 重要 ,0
下不去 很大 感到 根本 满意 ,0
无比 点评 补充 ,0
一般 介绍 像是 干净 很小 改建 救生 方便 根本 没有 甚远 相差 看起来 通道 ,0
不好 服务 真的 知道 评上 ,0
出水 很小 成旧 方便 比较 洗澡 装修 ,0
入住 冷淡 反馈 希望 必然 挑衅 提出 整改 方便 服务 比较 满意 现已 觉得 认真 记得 起来 ,0
好像 安排 应该 没有 装修 说明 豪华 购买 需要 ,0
入睡 快捷 根本 潮湿 符合 认为 ,0
不错 休息 入住 反馈 各异 喜欢 安排 实在 就是 希望 很大 感受 报歉 正面 没有 没睡 邻近 采光 需求 首先 ,0
不会 不到 不同 估计 入住 关不上 反馈 挂牌 根本 欢迎 正式 用完 装修 设备 选择 逐步 ,0
俯首 居然 抬头 最大 解释 ,0
不到 不错 严重 宽敞 就是 帮忙 开始 投诉 根本 比较 没有 洗浴 看到 被骗 见到 连门 鄙视 高速 ,0
上当 听到 居然 明显 特别 稍微 ,0
一经 事先 交费 侥幸 借鉴 切不可 发表 唯独 奉劝 感想 搞笑 来收 模仿 没有 特大 犯晕 的直 要命 要钱 说明 ,0
不理 付钱 催促 免费 入住 办成 升级 发现 发生 变成 居然 据说 服务 没有 清洁 满意 漂白 退房 造成 预定 ,0
不理 付钱 催促 免费 入住 办成 升级 发现 发生 变成 居然 据说 服务 没有 清洁 满意 漂白 退房 造成 预定 ,0
享受 凑合 失望 好像 就是 方便 正常 毫无 没有 超市 连接 隔开 ,0
下水 不会 不好 不敢 休息 免费 出去 出差 吃饭 吵得 回来 安排 开始 开脱 很早 很脏 恼火 打不开 服务 没有 真的 知道 碰到 简陋 经常 考虑 装修 解释 豪华 还有 进不了 退房 预订 ,0
不好 搔扰 ,0
不符 漂亮 破烂 ,0
不住 就是 很贵 担保 改变 没有 看到 ,0
服务 设备 ,0
不会 不到 不想 不计 估计 何在 倒是 入住 决定 加上 勉强 发现 只能 好不 就是 就让 居然 希望 开始 归类 想下 想不出 搞不好 教育 方便 服务 根本 正常 烹饪 略过 看到 知道 硬是 算是 管理 老是 表示歉意 装作 觉得 设备 赶走 适用 道歉 ,0
不会 不到 不想 不计 估计 何在 倒是 入住 决定 加上 勉强 发现 只能 好不 就是 就让 居然 希望 开始 归类 想下 想不出 搞不好 教育 方便 服务 根本 正常 烹饪 略过 看到 知道 硬是 算是 管理 老是 表示歉意 装作 觉得 设备 赶走 适用 道歉 ,0
不想 便利 值得 应该 很旧 没有 留恋 简单 ,0
一般 不好 值钱 帮忙 幸好 拆开 拿走 擅自 查房 直接 真是 知道 翻看 需要 ,0
到底 只给 告知 开始 提供 没有 知道 能够 要求 预定 ,0
不想 便利 值得 应该 很旧 没有 留恋 简单 ,0
一般 不好 值钱 帮忙 幸好 拆开 拿走 擅自 查房 直接 真是 知道 翻看 需要 ,0
只能 完事 ,0
勉强 大早 很大 要命 赶紧 ,0
不好意思 不能 估计 光临 加强 即将 反映 反馈 发生 可惜 尽可能 建设 当班 很大 惊讶 感到 抱歉 拿走 掌握 收拾 显灵 期待 清楚 相应 看到 真的 硬是 确认 离开 突然 竣工 装修 记得 调查 起来 难道 非常 ,0
不好意思 不能 估计 光临 加强 即将 反映 反馈 发生 可惜 尽可能 建设 当班 很大 惊讶 感到 抱歉 拿走 掌握 收拾 显灵 期待 清楚 相应 看到 真的 硬是 确认 离开 突然 竣工 装修 记得 调查 起来 难道 非常 ,0
修葺 加以 加强 应该 有的 服务 比较 没有 翻新 配套 ,0
不能 发现 洗不掉 竟然 ,0
不做 不好 不来 不能 付钱 值班 入住 告知 回答 处理 得知 感到 愿意 授权 接待 提前 提高 服务 用于 登记 着急 竟然 签字 简直 自然 至少 行为 觉得 解冻 解释 询问 诧异 质疑 通知 需要 ,0
不能 入住 尤其 接待 服务 欢迎 没有 真的 较差 ,0
不会 不到 不能 便宜 删除 实在 打算 至少 ,0
下车 不吃 不在 不好 不理 不能 不让 付款 休息 入住 吃上 吃饭 告诉 奉劝 就是 希望 帮忙 干净 往返 想到 感受 愿意 拖到 推荐 旅游 正常 没有 直接 相信 知道 粗糙 耽误 蛮横 解决 豪华 转头 进去 退票 高快 高速 ,0
一定 一般 上网 不好 不小 不能 也别 争取 住下 催促 允许 出去 出门 原先 只好 可惜 可笑 号称 吃饱 坚决 大约 奖励 导致 就是 帮忙 开门 彻底 打印 承诺 投诉 按下 损坏 提供 提前 提议 摔上 方便 是否 极度 消费 用来 看看 离开 竟然 签约 给开 绝对 罚多 考虑 背着 自助 荒凉 表示 裂开 要求 详单 赔付 赔偿 还有 遍地 随口 随手 马上 ,0
严重 尤其 影响 无奈 洗完 糟糕 设计 退房 非常 ,0
一般 不到 不错 已经 来讲 比较 没有 登封 竟然 简陋 超市 还有 阴暗 ,0
一般 不到 不错 已经 来讲 比较 没有 登封 竟然 简陋 超市 还有 阴暗 ,0
免费 才能 打开 放在 看电视 设备 ,0
一定 ,0
不能 前评 取消 可能 居然 恐怖 打扫 没有 疑似 ,0
丰富 只能 ,0
不低 对得起 挂牌 现代化 窄小 简陋 还有 ,0
不好 了认 例假 倒霉 入住 合理 实在 居然 希望 弄污 很小 打给 接受 沟通 给钱 罢休 表示 说法 赔不起 赔偿 降到 难以 预订 ,0
不好 了认 例假 倒霉 入住 合理 实在 居然 希望 弄污 很小 打给 接受 沟通 给钱 罢休 表示 说法 赔不起 赔偿 降到 难以 预订 ,0
也许 休息 便宜 嘈杂 很小 早就 显得 最差 服务 根本 没有 没法 结束 设计 ,0
上有 不了 不会 不好用 位置 反正 发展 可言 失望 好好 很脏 打扫 换到 来讲 没有 没问 甚至 ,0
竞争 绝望 缺少 较烂 选择 ,0
估计 好处 就是 服务 没有 相当 评估 越来越 还长 重新 ,0
竞争 绝望 缺少 较烂 选择 ,0
告知 预先 ,0
估计 好处 就是 服务 没有 相当 评估 越来越 还长 重新 ,0
一定 不盡 不能 丟失 他們 作為 你們 入住 出水 出現 副理 加在 北齊 協調 參加 只能 可能 品種 問題 啞巴 因為 好像 宴會 實在 就是 廣場 很高 快捷 態度 慎重 房價 房門 房間 才能 打電話 推卸 推薦 損失 擔憂 放在 放著 時候 時間 有的 服務 本著 查房 根本 檢查 氣憤 沒有 洗手 洗漱 清楚 減少 無從 用過 當時 真的 結果 繁多 考察 考證 聲稱 莫須 處理 蠻快 要用 解決 記得 責任 賠償 辦理 退房 這樣 造成 選擇 還是 銹住 電話 非常 預定 黃連 ,0
一定 不盡 不能 丟失 他們 作為 你們 入住 出水 出現 副理 加在 北齊 協調 參加 只能 可能 品種 問題 啞巴 因為 好像 宴會 實在 就是 廣場 很高 快捷 態度 慎重 房價 房門 房間 才能 打電話 推卸 推薦 損失 擔憂 放在 放著 時候 時間 有的 服務 本著 查房 根本 檢查 氣憤 沒有 洗手 洗漱 清楚 減少 無從 用過 當時 真的 結果 繁多 考察 考證 聲稱 莫須 處理 蠻快 要用 解決 記得 責任 賠償 辦理 退房 這樣 造成 選擇 還是 銹住 電話 非常 預定 黃連 ,0
设备 ,0
一般 不会 客满 居然 超大 送餐 ,0
设备 ,0
一般 不会 客满 居然 超大 送餐 ,0
一块块 一定 不够 不规则 亲切 光临 入住 全新 其实 再次 加强 卫生 反应 反映 反馈 合理 尊敬 尴尬 居然 工作 希望 很快 手续 抱怨 抱枕 抱歉 提出 改善 明显 服务 来换 没有 洗涤 深表歉意 清洁 留下 疑似 相关 看到 积极 被单 要求 觉得 调配 足足 迎接 选择 遇到 附赠 ,0
一块块 一定 不够 不规则 亲切 光临 入住 全新 其实 再次 加强 卫生 反应 反映 反馈 合理 尊敬 尴尬 居然 工作 希望 很快 手续 抱怨 抱枕 抱歉 提出 改善 明显 服务 来换 没有 洗涤 深表歉意 清洁 留下 疑似 相关 看到 积极 被单 要求 觉得 调配 足足 迎接 选择 遇到 附赠 ,0
一般 不会 不可能 不敢 不错 前住 可能 干净 开始 放心 没换 没洗 消毒 深刻 满意 相信 看起来 肯定 赶快 还好 非常好 ,0
位置 完全 就是 或许 服务 相当 紧邻 ,0
入住 其实 很小 点评 看起来 补充 豪华 ,0
一般 不会 不可能 不敢 不错 前住 可能 干净 开始 放心 没换 没洗 消毒 深刻 满意 相信 看起来 肯定 赶快 还好 非常好 ,0
入住 其实 很小 点评 看起来 补充 豪华 ,0
一定 一般 不会 不好 了不起 到处 北京人 发现 受气 可能 吃饭 想用 掏腰包 提醒 欺负 沟通 满分 知道 设计 还好 还有 郁闷 陪同 ,0
一般 可能 比较 看起来 ,0
一般 不少 包括 希望 强烈 很大 挂牌 是否 有霉 比较 没住 看到 算来 ,0
不可 不堪 不能 久远 介绍 仍然 入住 可住 完全 居然 希望 弥漫 极其 破败 简直 管理 糟糕 维护 腐霉 零乱 非常 ,0
不去 比较 装修 ,0
不会 了解 入住 出去 原处 原来 吹风 回到 大概 好处 委婉 安排 就是 拒绝 搞不定 操作 放弃 放归 比较 洗澡 满意 用完 相去 看房 看见 知道 装修 询问 请求 赶着 还有 进去 退房 选择 通知 长途 顺便 预定 ,0
招呼 相当 看见 舒服 遇到 ,0
不到 勉强 就是 ,0
刷牙 套紧 有的 没吐 没有 清洁 生锈 看到 睡觉 露出 ,0
下起 下雨 不断 仔细 出门 原来 去求 取电 吃饭 吓了一跳 听到 告知 喷出来 大一 安排 就算 就要 已经 干脆 开灯 开门 当然 得了 恳求 愿意 打开 持续 断裂 没用 洗完 洗澡 炒饭 直接 离开 突然 竟然 简单 终于 胶布 要求 起来 进门 退房 难吃 非常 ,0
不能 不错 便宜 值班 入住 出钱 发现 坚持 处理 好了 居然 工作 抱怨 提高 搬动 方便 最好 服务 真是 睡觉 知道 通知 ,0
好处 就是 没有 看出 ,0
看到 睡觉 非常 ,0
便宜 直接 ,0
不错 没有 知道 还有 ,0
不住 再也 发誓 郁闷 ,0
一般 不能 便是 入住 升级 启动 提供 摆设 改进 更换 服务 期待 正常 没有 破损 能够 豪华 ,0
佩服 厉害 变成 告诉 接到 搞笑 没有 睡觉 还有 骚扰 ,0
不好 好像 干脆 开封 按摩 没有 能算 设备 起来 骚扰 ,0
不好 好像 干脆 开封 按摩 没有 能算 设备 起来 骚扰 ,0
不算 便宜 发现 就是 已经 很小 方便 点评 知道 考虑 补充 要住 觉得 路过 还有 连锁 遗憾 ,0
不少 严重 交涉 仍旧 付款 借鉴 入住 再也 出行 分别 到达 原定 发现 受权 只得 可住 可言 吸取 坚决 失望 希望 抱歉 担保 拿到 换成 描述 提供 教训 毕竟 没有 简单 简直 莫名 要求 要签 解释 超定 险些 非常 ,0
不会 很小 ,0
不会 ,0
不少 亲耳 从来 免得 入住 副理 同意 否定 告诉 处处 奉劝 居然 并刷 引来 得到 懒得 投诉 抬头 拒绝 提出 更多 没有 特意 等到 签订 能否 自动 行不行 见到 解释 详细 请示 赶时间 退房 选择 锁定 问住 ,0
不少 亲耳 从来 免得 入住 副理 同意 否定 告诉 处处 奉劝 居然 并刷 引来 得到 懒得 投诉 抬头 拒绝 提出 更多 没有 特意 等到 签订 能否 自动 行不行 见到 解释 详细 请示 赶时间 退房 选择 锁定 问住 ,0
一般 不错 到达 失望 实在 就是 并排 打扫 服务 没有 洗澡 浓烈 点评 连挡 ,0
便宜 可能 吓人 呵呵 差别 得到 感受到 拿到 直接 看到 看去 突然 进去 ,0
好看 必要 搬家 要死 觉得 ,0
不能 何在 入住 反过来 吃饭 告知 已经 干净 提醒 日出 服务 根本 比较 没有 观察 订掉 进来 郁闷 预订 ,0
一般 不会 到达 很大 选择 ,0
不可能 免费 完全 延迟 退房 ,0
不到 不好 工作 提出 提醒 服务 查房 比较 没有 要求 ,0
入住 制定 就是 当然 恰好 授权 接待 无奈 歧视 没有 混乱 通知 鄙视 难道 预定 ,0
一般 不会 关闭 卫生 说话 顺畅 ,0
可能 恶劣 服务 非常 ,0
不靠 也许 入住 原来 只能 告诉 外出 实际上 就让 忘带 换出 搬进 服务 没有 甚至 真的 觉得 豪华 ,0
一般 不够 不爽 喜欢 弥补 搞错 方便 旅游 最好 比较 没有 点评 竟然 简单 算是 补充 逛街 ,0
可能 恶劣 服务 非常 ,0
不好用 几乎 很小 没法 满意 超差 非常 预订 ,0
好看 必要 搬家 要死 觉得 ,0
不靠 也许 入住 原来 只能 告诉 外出 实际上 就让 忘带 换出 搬进 服务 没有 甚至 真的 觉得 豪华 ,0
一般 不够 不爽 喜欢 弥补 搞错 方便 旅游 最好 比较 没有 点评 竟然 简单 算是 补充 逛街 ,0
不出 包天 提供 牙刷 ,0
不开 听到 就是 很大 比较 睡不着 简直 非常 靠近 ,0
一直 不同 不能 为主 也许 便利 做到 光临 入住 再次 努力 包括 反馈 听到 喜好 完工 尊敬 就是 希望 很大 愉快 感受到 投入 投诉 提供 提到 提高 收到 改变 改进 最大 服务 正是 比较 深表歉意 满足 珍惜 简直 能够 装修 进步 进行 遇到 重新 非常 靠近 ,0
不出 包天 提供 牙刷 ,0
不开 听到 就是 很大 比较 睡不着 简直 非常 靠近 ,0
一直 不同 不能 为主 也许 便利 做到 光临 入住 再次 努力 包括 反馈 听到 喜好 完工 尊敬 就是 希望 很大 愉快 感受到 投入 投诉 提供 提到 提高 收到 改变 改进 最大 服务 正是 比较 深表歉意 满足 珍惜 简直 能够 装修 进步 进行 遇到 重新 非常 靠近 ,0
不得体 不满 了下 假道 到达 升级 协调 原来 反馈 可惜 告诉 好好 完全 完差 尴尬 延迟 开门 引来 引起 想法 拒绝 拿到 提前 撤掉 改变 放松 放置 最终 服务 毕竟 清楚 疏忽 直白 真正 睡下 知道 稍后 稍稍 简单 装修 询问 退房 送错 选择 道歉 随后 预定 ,0
包装 卫生 完整 整洁 较差 ,0
一般 偏远 服务 ,0
包装 卫生 完整 整洁 较差 ,0
不吃 不行 交涉 值班 发现 只能 回答 实在 就是 居然 带来 应该 服务 没有 要求 豪华 远离 ,0
不用 中转 估计 准时 响起 就是 干吗 按摩 掂量 晓得 更多 比较 没有 真的 还有 ,0
不快 不想 不理 入住 就是 手续 服务 点评 的确 补充 ,0
不吃 不行 交涉 值班 发现 只能 回答 实在 就是 居然 带来 应该 服务 没有 要求 豪华 远离 ,0
不用 中转 估计 准时 响起 就是 干吗 按摩 掂量 晓得 更多 比较 没有 真的 还有 ,0
不快 不想 不理 入住 就是 手续 服务 点评 的确 补充 ,0
一次性 一般 不会 不能 不高 值得 准备 包装 反正 发现 可能 实在 已经 意味着 据称 显著 服务 比较 没有 特别 甚至 相当 看不出 称道 肯定 舒服 试试 说明 需要 ,0
一次性 一般 不会 不能 不高 值得 准备 包装 反正 发现 可能 实在 已经 意味着 据称 显著 服务 比较 没有 特别 甚至 相当 看不出 称道 肯定 舒服 试试 说明 需要 ,0
可能 实在 旅游 ,0
入住 入眠 反映 就是 强调 紧靠 非常 ,0
发霉 推荐 知道 非常 ,0
